排名,标题,热度
1,离职时我把工资告诉了同事,2258536
2,头发居然可以扎进肉里,1411589
3,杭州亚运会奖牌亮相,1297013
5,快乐大本营最后一期未播预告,1260776
6,网友爆料宁艺卓是孟美岐导师,1216740
7,黄晓明生图,994456
9,球迷冲进球场抱梅西,970515
10,关晓彤25岁身材管理,755839
11,52岁大叔以身试险1小时劝退10多名游客,642453
12,原来X光下的婴儿小手长这样,638891
13,薛之谦 再见啦梅西,527628
14,冰清玉洁近况,521840
15,苏醒见完梅西偶遇来迟的薛之谦,487294
16,陈宏军叶芳离婚,476587
17,女生摆摊卖鸡脚边卖边吃,450904
18,年入7万在江苏难不难,393494
19,冲进球场抱梅西球迷面临什么处罚,383694
20,连那英都接不住的场子,373470
21,朱珠浪姐结束后去HEC上学了,356833
22,海底捞回应8块钱生菜仅2片,322929
23,女导游穿紧身裤被质疑是色情营销,322245
24,考公上岸后被同学删了微信,320650
25,男生中考忘涂机读卡妈妈大哭,320005
26,阿根廷2比0,318936
27,研一和研三读文献时的区别,274420
28,古偶四大白发,252146
29,50岁阿姨疑遭20岁快递员猥亵,248671
30,冲进球场抱梅西球迷回应,223825
31,熬夜给身体带来的损伤几乎是不可逆的,213543
32,张大大直播间网友倒立洗头,206842
33,袁弘 搞到梅西to签,205746
34,可以回复任何内容的中文,204128
35,梅西81秒进球,195525
36,刘惜君远远看到梅西很开心,193747
37,安保公司回应球迷冲进球场抱梅西,193284
38,NCT dream,186882
39,黄晓明的P图技术,185476
40,易烊千玺打招呼姿势,183892
41,第一次感觉老头背心好帅,182976
42,六公主,179206
43,办完离职还要等下班才能走,178799
44,吴宣仪晒和刘诗诗比耶合照,169531
45,张小斐说现在的红毯生图非常生,160891
46,你睡觉到底有多晚,156855
47,阿根廷vs澳大利亚,156248
48,范丞丞23岁了,154732
49,杨紫羊毛卷,152547
50,狗子晚上不回家和狗友出去玩,150818
51,阿娇阿Sa给容祖儿庆生,135642
52,集体越狱的萨摩耶宝宝,133461
