排名,标题,热度
1,TFBOYS十年之约演唱会官宣,8527509
2,这次真的通知了他们仨,3313230
3,杭州亚运形象宣传片弄潮,2299877
4,吴倩退出乘风,1899517
5,感觉这三个名字排在一起是上辈子的事,1729251
6,我老了追易烊千玺的样子,1342711
8,苏翊鸣发文回应保送清华大学,1019830
9,离职时我把工资告诉了同事,986477
10,球迷冲进球场抱梅西,950747
11,私人山庄遭网红闯入并渲染成鬼屋,886027
12,时代峰峻,882383
13,向佐郭碧婷为二胎儿子办周岁宴,880301
14,黄晓明油过没丑过,877818
15,袁弘 搞到梅西to签,649490
16,交警买网红青蛙小青蛙不让付钱,594238
17,王俊凯王源易烊千玺转发十年之约演唱会,532857
18,黄晓明生图,508084
19,快乐大本营最后一期未播预告,499595
20,原来X光下的婴儿小手长这样,448700
21,女生摆摊卖鸡脚边卖边吃,419089
22,女导游穿紧身裤被质疑是色情营销,416239
23,考公上岸后被同学删了微信,408179
24,网友爆料宁艺卓是孟美岐导师,393702
25,高校回应干部不正当男女关系被抓现行,343250
26,对你来说月薪1万够花吗,308265
27,TFBOYS的数字浪漫,307516
28,乘风帮唱师姐官宣,301820
29,TFBOYS要出新歌了吗,297700
30,薛之谦 再见啦梅西,293219
31,离职要不要收回份子钱,290915
32,TFBOYS十周年联名,290742
33,连那英都接不住的场子,284374
34,冰清玉洁近况,281157
35,民警为查毒品剥开32吨洋葱,260833
36,时光2定档,245192
37,TFBOYS十年前出道形象片,242437
38,阿根廷2比0,232153
39,四叶草过年了,229944
40,中国水中大熊猫外网火了,227447
41,你晚上一般睡多久,226345
42,范丞丞晒一片菜叶生日面,226267
43,迪丽热巴冷脸vs笑脸,221423
44,雪鹰领主,213862
45,被李健这段话治愈了恋爱焦虑,212443
46,肖战李沁冬日拾光大片,204915
47,陈宏军叶芳离婚,203863
48,比尔盖茨,200355
49,苏醒见完梅西偶遇来迟的薛之谦,198108
50,52岁大叔以身试险1小时劝退10多名游客,197957
51,头发居然可以扎进肉里,197821
