排名,标题,热度
1,黄晓明和宋慧乔演过情侣,996260
2,到底是谁惹了六公主,888067
3,杭州亚运村内部功能区首次公开亮相,821857
5,迪丽热巴真发了100多张自拍,793262
6,秋瓷炫 我不是不要脸,736204
7,冲进球场男子被行拘,636812
9,难哄,600070
10,国足4比0战胜缅甸队,417504
11,杜江问梅西嗯哼的签名照是真迹吗,334165
12,为暗恋对象做了200页PPT,333006
13,曝一高校女寝空调限时男寝全天使用,331844
14,向太,330584
15,宋仲基 成为父亲和丈夫会失去很多工作,330530
16,上海大学一男生疑对多名女生精神控制,328481
17,汪汪队立大功吓退涉嫌跟踪的男子,327939
18,郭碧婷穿衣风格向太化,326854
19,吴倩方晒出院记录,324611
20,TFBOYS十年之约演唱会官宣,323563
21,当丈夫说妻子在家啥也不干,323276
22,乘地铁被冤枉偷拍的成都男子再发声,323155
23,天津大学扣饭事件后烤鸭饭窗口排长队,323118
24,原来近视是需要忌口的,323027
25,内娱还会有第二个TFBOYS吗,322859
26,王一博再戴麦穗胸针,322783
27,一定要睡个好觉的原因,322659
28,袁隆平推广到非洲的杂交稻收割了,322482
29,王一博首个电影男主角荣誉,322421
30,肖春生问叶国华孩子几岁了,306697
31,aespa演唱会,294791
32,EDG赛前海报,204142
33,柳智敏 艺人没时间是骗人的,200059
34,TFBOYS演唱会投票,194658
35,Jennie去爬山了,190214
36,无穷小亮在旅途中拍到的震撼景色,184684
37,穿袜子千万别穿洞洞鞋,183694
38,梅西回应到中国大部分时间待在酒店,182692
39,吴青峰起风了大合唱,176486
40,偷偷藏不住定档,170114
41,当我出门忘关16度的空调,151448
42,偷偷藏不住换滤镜了,151122
43,杨紫回复杨迪都是一家的,149356
44,肖春生佟晓梅终于结婚了,148260
45,马伯骞并非难哄桑延选角,146794
46,法老抢到捧花,144492
47,嘤嘤怪这谁受得了啊,142892
48,洗碗工收到工资给老板500元感谢,142846
49,LNG海报,136246
50,少耶和我,131678
51,中国女排vs保加利亚女排,124037
52,男装周,119494
