排名,标题,热度
1,梅西回应到中国大部分时间待在酒店,1920607
2,偷偷藏不住定档,1305405
3,杭州亚运村内部功能区首次公开亮相,1124859
5,嗯哼 追星成功太开心啦,1123813
6,杜江问梅西嗯哼的签名照是真迹吗,1122190
7,到底是谁惹了六公主,1058176
9,吴倩方晒出院记录,959384
10,郭碧婷穿衣风格向太化,959380
11,新闻学教授怒怼张雪峰,698049
12,交警买网红青蛙小青蛙不让付钱,567742
13,李飞P图不严谨啊,567641
14,TFBOYS公式照,566195
15,6女生写信控诉上大一研究生性剥削,565258
16,TFBOYS十年之约演唱会官宣,563927
17,Jennie去爬山了,563457
18,我老了追易烊千玺的样子,439482
19,离职时我把工资告诉了同事,305257
20,孙女辞职带患癌爷爷4年花10万游9省,249214
21,EDG康康五杀,217746
22,EDG惜败欧洲第一TL,200240
23,阿玛尼粉底液,199727
24,向佐郭碧婷为二胎儿子办周岁宴,199476
25,人体含水量最多的器官,198671
26,女导游穿紧身裤被质疑是色情营销,197858
27,就差杨幂了,197290
28,鹿晗北京站出座位了,196335
29,洞洞鞋的正确洗脚方法,195982
30,邓典果结婚,195042
31,Angelababy欧阳娜娜金靖上海夜骑,194654
32,TES战胜LGD,194236
33,公司端午节发了200元红包,193113
34,张元英穿了中国粉丝送的裙子,193030
35,黄晓明提问比尔盖茨,182576
36,赵露思马伯骞新剧演兄妹,181382
37,和神仙公司续签了5年合同,179564
38,杨和苏去婚礼走错地方,179267
39,女儿高考完提出3个要求妈妈崩溃,178235
40,凌晨被室友在宿舍群里艾特,175536
41,唐嫣演出古代才女的竹韵风骨,174952
42,618直播闪降节爆款降到底,174583
43,女子举牌烈日下站6小时求复婚,174400
44,高校一干部不正当男女关系被抓现行,172433
45,吴倩退出乘风,171378
46,黄晓明油过没丑过,170357
47,刘雅瑟喝水vs张嘉倪喝水,167065
48,TFBOYS13年vs23年,163305
49,考科目二因为没开空调挂了,151634
50,偷偷藏不住,151023
51,voba,150914
52,大学班主任哽咽送别毕业生,138387
