排名,标题,热度
1,杜江问梅西嗯哼的签名照是真迹吗,1363828
2,孙女辞职带患癌爷爷4年花10万游9省,1253308
3,杭州亚运村内部功能区首次公开亮相,1212823
5,郭碧婷穿衣风格向太化,1201837
6,洗碗工收到工资给老板500元感谢,1168145
7,黄晓明和宋慧乔演过情侣,1154900
9,交警买网红青蛙小青蛙不让付钱,1014092
10,偷偷藏不住定档,993315
11,嗯哼 追星成功太开心啦,867159
12,到底是谁惹了六公主,802649
13,天津大学扣饭事件后烤鸭饭窗口排长队,789068
14,TFBOYS公式照,751886
15,吴倩方晒出院记录,550217
16,上海大学一男生疑对多名女生精神控制,541784
17,TFBOYS十年之约演唱会官宣,515475
18,李飞P图不严谨啊,505023
19,6女生写信控诉上大一研究生性剥削,504119
20,拼门的快乐谁懂啊,503370
21,宁安如梦,502682
22,梅西回应到中国大部分时间待在酒店,496280
23,两千三的工资面了三轮,496253
24,女导游穿紧身裤被质疑是色情营销,380935
25,当我出门忘关16度的空调,371298
26,人体含水量最多的器官,316652
27,周杰伦上海演唱会已过审,304656
28,李莎旻子发两千字长文告别乘风,298128
29,Jennie去爬山了,281319
30,国足vs缅甸,237887
31,跳槽新公司结果被辞退了,228855
32,ZB1开通微博,223110
33,向太,222213
34,LNG海报,220194
35,新闻学教授怒怼张雪峰,219068
36,张元英穿了中国粉丝送的裙子,217187
37,还以为肖战夹着皮包,215239
38,第五人格,210117
39,我宣布他研究出了蟑螂药,209893
40,龚俊金晨一起吃烤肉,201316
41,黄瓜做成了我吃不起的样子,190020
42,常识是文明的力量争来的,189396
43,小时候不懂为什么会有边放水边加水的数学题,182159
44,没点文化都看不懂朋友圈了,181472
45,民警帮忙找到4万现金大娘豪气请吃饭,177076
46,黄晓明油过没丑过,169994
47,离职时我把工资告诉了同事,162874
48,就差杨幂了,160688
49,邓典果结婚,157556
50,鹿晗北京站出座位了,156021
51,郑秀妍没帮唱Amber,149918
52,蔡徐坤香港演唱会倒计时,146930
