排名,标题,热度
1,TFBOYS十年之约演唱会官宣,5819293
2,快乐大本营最后一期未播预告,1505374
3,杭州亚运会奖牌亮相,1451310
5,离职时我把工资告诉了同事,1440997
6,袁弘 搞到梅西to签,1062169
7,网友爆料宁艺卓是孟美岐导师,912382
9,球迷冲进球场抱梅西,860084
10,黄晓明生图,758298
11,私人山庄遭网红闯入并渲染成鬼屋,714053
12,头发居然可以扎进肉里,415628
13,向佐郭碧婷为二胎儿子办周岁宴,415019
14,原来X光下的婴儿小手长这样,407523
15,陈宏军叶芳离婚,407423
16,关晓彤25岁身材管理,404343
17,蛋仔派对一周年,394350
18,女生摆摊卖鸡脚边卖边吃,391710
19,苏醒见完梅西偶遇来迟的薛之谦,378343
20,冰清玉洁近况,364804
21,52岁大叔以身试险1小时劝退10多名游客,327288
22,古偶四大白发,325430
23,女导游穿紧身裤被质疑是色情营销,322242
24,考公上岸后被同学删了微信,321443
25,薛之谦 再见啦梅西,317340
26,阿根廷2比0,266167
27,冲进球场抱梅西球迷面临什么处罚,237943
28,男生中考忘涂机读卡妈妈大哭,231483
29,梅西过人好牛,227579
30,主人真的很宠它 它也是真的很蠢,226733
31,贺红玲给肖春生佟晓梅随礼,210474
32,研一和研三读文献时的区别,208984
33,王一博情绪主题视频,208687
34,迪丽热巴冷脸vs笑脸,208238
35,连那英都接不住的场子,207749
36,戳爷问怎么接近黄铉辰,206271
37,为啥理发店没有女理发师,194397
38,我当不了站姐的原因,190942
39,毕业搬家才知道生活费都去哪了,190524
40,海底捞回应8块钱生菜仅2片,189661
41,50岁阿姨疑遭20岁快递员猥亵,180798
42,好多明星去看了梅西比赛,166312
43,冲进球场抱梅西球迷回应,163304
44,朱珠浪姐结束后去HEC上学了,162302
45,向往的生活,160549
46,张小斐说现在的红毯生图非常生,159851
47,六公主,159134
48,岳云鹏说我跟白敬亭最像P上去的,150698
49,严浩翔换新发型,145379
50,熬夜给身体带来的损伤几乎是不可逆的,140585
51,可以回复任何内容的中文,135705
52,摄影师记录下的被豹子发现后,130925
