排名,标题,热度
1,薛之谦 再见啦梅西,1594098
2,52岁大叔以身试险1小时劝退10多名游客,1243289
3,杭州亚运会奖牌亮相,1089192
4,关晓彤25岁身材管理,1079278
5,朱珠浪姐结束后去HEC上学了,1039851
6,海底捞回应8块钱生菜仅2片,997637
8,球迷冲进球场抱梅西,985446
9,你睡觉到底有多晚,928360
10,冰清玉洁近况,905994
11,头发居然可以扎进肉里,881779
12,陈宏军叶芳离婚,776767
13,黄晓明生图,485338
14,苏醒见完梅西偶遇来迟的薛之谦,454006
15,六公主,349529
16,青2黄一鸣生女,332871
17,杨紫羊毛卷,332628
18,阿根廷2比0,327115
19,贺红玲被肖春生佟晓梅包围了,306347
20,女生摆摊卖鸡脚边卖边吃,303033
21,连那英都接不住的场子,252416
22,男生中考忘涂机读卡妈妈大哭,251850
23,范丞丞23岁了,251552
24,张踩铃 当一个混血被双语幼儿园拒收,250862
25,一位韩国爸爸带女儿去夜店,249097
26,梅西81秒进球,239374
27,肖春生佟晓梅情侣头像,234704
28,高考结束发现被妈妈骗了,221290
29,第一次感觉老头背心好帅,214279
30,孟子义说曾舜晞我谈没谈你不知道吗,213930
31,梅西穿中文球衣,207019
32,年入7万在江苏难不难,204584
33,找到蔡徐坤是i人的证据,202498
34,淘宝红包,198110
35,过度打扮的女友和随意的男友,195739
36,校方回应地铁事件女子在科技作品署名,190829
37,阿根廷vs澳大利亚,190201
38,黄新淳晒合照为范丞丞庆生,186187
39,只可能在娘家看到的一幕,183797
40,嵩山音乐节 退票,169589
41,快乐大本营,163048
42,梅西过人好牛,160481
43,狗狗永远是人类最好的朋友,152336
44,董思成去看了梅西比赛,151574
45,张小斐说现在的红毯生图非常生,148234
46,苏醒 我离梅西好远,144121
47,快乐大本营主持人现状,142532
48,不要因为睡不着而烦恼,141244
49,扣饭事件学院称不清楚女生是否精神异常,141024
50,卖杏老人儿子望偷拿女子澄清或道歉,130200
51,贾乃亮黄景瑜评论区互怼,124629
