排名,标题,热度
1,TFBOYS十年之约演唱会官宣,3210392
2,吴倩退出乘风,1894108
3,杭州亚运形象宣传片弄潮,1489148
5,感觉这三个名字排在一起是上辈子的事,1404706
6,TFBOYS公式照,1202586
7,新闻学教授怒怼张雪峰,1029950
8,张元英穿了中国粉丝送的裙子,1023989
9,球迷冲进球场抱梅西,816638
10,私人山庄遭网红闯入并渲染成鬼屋,792166
11,苏翊鸣发文回应保送清华大学,769204
12,黄晓明油过没丑过,767850
13,这次真的通知了他们仨,767363
14,我老了追易烊千玺的样子,753467
15,袁弘 搞到梅西to签,677133
16,王俊凯王源易烊千玺转发十年之约演唱会,675121
17,交警买网红青蛙小青蛙不让付钱,562371
18,向佐郭碧婷为二胎儿子办周岁宴,560548
19,原来X光下的婴儿小手长这样,515155
20,离职时我把工资告诉了同事,501896
21,女生摆摊卖鸡脚边卖边吃,237852
22,女导游穿紧身裤被质疑是色情营销,237201
23,邓典果结婚,236672
24,时代峰峻,235749
25,考公上岸后被同学删了微信,235326
26,女儿高考完提出3个要求妈妈崩溃,234129
27,黄晓明生图,233348
28,TFBOYS快闪活动,232994
29,快乐大本营最后一期未播预告,231762
30,刘诗诗罗云熙 白日提灯,231283
31,梅西回应到中国大部分时间待在酒店,230817
32,郑秀妍没帮唱Amber,229459
33,Angelababy秀身材,228481
34,Uzi获得亚洲荣誉选手,227034
35,高校回应干部不正当男女关系被抓现行,204560
36,薛之谦 再见啦梅西,191570
37,连那英都接不住的场子,191375
38,美依礼芽个人喜爱度第一,190073
39,李飞赚不完根本赚不完,188289
40,女童吞下上百颗磁力珠肠道如鱼籽,184805
41,高校一干部不正当男女关系被抓现行,184027
42,迪丽热巴藏蓝色风衣搭白T,182640
43,在快本写给十年后的信会公开吗,181983
44,吴优淘汰谢娜大哭,180609
45,TFBOYS的数字浪漫,178202
46,山东一地请2400多名高考生撸串,177999
47,比尔盖茨,167665
48,头发居然可以扎进肉里,166911
49,警方上门调解儿媳穿短裤被打事件,166635
50,公司的下午茶能有多炸裂,166616
51,棕熊妈妈将两只小熊护在身后,166542
