排名,标题,热度
1,到底是谁惹了六公主,2162684
2,李飞P图不严谨啊,1675498
3,杭州亚运形象宣传片弄潮,1270108
5,Jennie去爬山了,1244158
6,新闻学教授怒怼张雪峰,1226320
7,吴倩方晒出院记录,987194
9,偷偷藏不住定档,960191
10,交警买网红青蛙小青蛙不让付钱,448624
11,苏翊鸣发文回应保送清华大学,407678
12,离职时我把工资告诉了同事,373614
13,黄晓明油过没丑过,366869
14,TFBOYS十年之约演唱会官宣,358573
15,就差杨幂了,354364
16,王俊凯王源易烊千玺转发十年之约演唱会,339600
17,父亲去世34年82岁儿子仍在给他写信,331140
18,TFBOYS公式照,325003
19,高校一干部不正当男女关系被抓现行,321935
20,梅西回应到中国大部分时间待在酒店,319970
21,球迷冲进球场抱梅西,250220
22,袁弘 搞到梅西to签,233138
23,人体含水量最多的器官,230978
24,张元英穿了中国粉丝送的裙子,230329
25,吴倩退出乘风,226824
26,女导游穿紧身裤被质疑是色情营销,223046
27,美64岁大学教授和牧羊犬发生性行为,219727
28,感觉这三个名字排在一起是上辈子的事,216791
29,邓典果结婚,215421
30,向佐郭碧婷为二胎儿子办周岁宴,211464
31,考公上岸后被同学删了微信,210708
32,女儿高考完提出3个要求妈妈崩溃,209729
33,我老了追易烊千玺的样子,204836
34,杨和苏去婚礼走错地方,200416
35,Angelababy秀身材,200152
36,6女生写信控诉上大一研究生性剥削,188478
37,比尔盖茨,186350
38,TFBOYS13年vs23年,181046
39,李飞赚不完根本赚不完,180390
40,给梅西送球小哥曾获北马非职业第一名,172074
41,私人山庄遭网红闯入并渲染成鬼屋,164050
42,结婚后工资要各花各的吗,162577
43,郑秀妍没帮唱Amber,161345
44,刘诗诗罗云熙 白日提灯,160222
45,连那英都接不住的场子,156777
46,视力矫正手术,156035
47,吴优淘汰谢娜大哭,153595
48,原来X光下的婴儿小手长这样,152429
49,快乐大本营最后一期未播预告,150148
50,这些软件到底是谁在用,147351
51,凌晨被室友在宿舍群里艾特,140086
52,被Uzi的评论区整破防了,135734
