排名,标题,热度
1,薛之谦 再见啦梅西,1743561
2,52岁大叔以身试险1小时劝退10多名游客,1260566
3,杭州亚运会奖牌亮相,1146006
5,朱珠浪姐结束后去HEC上学了,1119048
6,球迷冲进球场抱梅西,1037028
7,海底捞回应8块钱生菜仅2片,906067
8,冰清玉洁近况,894886
9,陈宏军叶芳离婚,873746
10,关晓彤25岁身材管理,854495
11,头发居然可以扎进肉里,843896
12,你睡觉到底有多晚,594034
13,黄晓明生图,553404
14,苏醒见完梅西偶遇来迟的薛之谦,477299
15,连那英都接不住的场子,474146
16,阿根廷2比0,379711
17,年入7万在江苏难不难,368377
18,杨紫羊毛卷,338337
19,六公主,332856
20,青2黄一鸣生女,319776
21,贺红玲被肖春生佟晓梅包围了,290637
22,男生中考忘涂机读卡妈妈大哭,286518
23,范丞丞23岁了,280762
24,女生摆摊卖鸡脚边卖边吃,270547
25,梅西81秒进球,248337
26,梅西穿中文球衣,224929
27,张踩铃 当一个混血被双语幼儿园拒收,221407
28,阿根廷vs澳大利亚,220708
29,肖春生佟晓梅情侣头像,207330
30,第一次感觉老头背心好帅,197008
31,高考结束发现被妈妈骗了,192290
32,找到蔡徐坤是i人的证据,190751
33,张小斐说现在的红毯生图非常生,185347
34,梅西过人好牛,181442
35,过度打扮的女友和随意的男友,178757
36,嵩山音乐节 退票,171746
37,只可能在娘家看到的一幕,170489
38,集体越狱的萨摩耶宝宝,168318
39,校方回应地铁事件女子在科技作品署名,165981
40,快乐大本营主持人现状,165095
41,扣饭事件学院称不清楚女生是否精神异常,160781
42,董思成去看了梅西比赛,158731
43,淘宝红包,151530
44,孟子义说曾舜晞我谈没谈你不知道吗,146629
45,苏醒 我离梅西好远,146192
46,狗狗永远是人类最好的朋友,143557
47,吴宣仪晒和刘诗诗比耶合照,142179
48,不要因为睡不着而烦恼,137892
49,快乐大本营,126479
50,一位韩国爸爸带女儿去夜店,126462
51,黄新淳晒合照为范丞丞庆生,114266
