排名,标题,热度
1,吴倩退出乘风,1911027
2,TFBOYS十年之约演唱会官宣,1870814
3,杭州亚运形象宣传片弄潮,1510700
4,感觉这三个名字排在一起是上辈子的事,1344819
5,TFBOYS公式照,1325522
6,新闻学教授怒怼张雪峰,1271312
8,张元英穿了中国粉丝送的裙子,1155523
9,私人山庄遭网红闯入并渲染成鬼屋,968679
10,袁弘 搞到梅西to签,677110
11,苏翊鸣发文回应保送清华大学,658364
12,黄晓明油过没丑过,611066
13,王俊凯王源易烊千玺转发十年之约演唱会,575623
14,原来X光下的婴儿小手长这样,539026
15,我老了追易烊千玺的样子,536018
16,48岁女医生辞世捐器官救3人,513243
17,球迷冲进球场抱梅西,510184
18,这次真的通知了他们仨,499568
19,向佐郭碧婷为二胎儿子办周岁宴,441924
20,离职时我把工资告诉了同事,412345
21,梅西回应到中国大部分时间待在酒店,305458
22,女导游穿紧身裤被质疑是色情营销,304416
23,邓典果结婚,304106
24,肖战李沁梦海吻戏,302381
25,交警买网红青蛙小青蛙不让付钱,300632
26,考公上岸后被同学删了微信,297509
27,李飞赚不完根本赚不完,287634
28,Angelababy秀身材,275543
29,王一博片场和导演讨论角色发型,272268
30,女儿高考完提出3个要求妈妈崩溃,267090
31,美64岁大学教授和牧羊犬发生性行为,239137
32,人体含水量最多的器官,238594
33,时代峰峻,237679
34,郑秀妍没帮唱Amber,236828
35,Jennie去爬山了,235607
36,李飞P图不严谨啊,234617
37,刘诗诗罗云熙 白日提灯,234271
38,高校一干部不正当男女关系被抓现行,233670
39,周五下班的我,216376
40,这些软件到底是谁在用,191794
41,Uzi获得亚洲荣誉选手,185691
42,吴优淘汰谢娜大哭,185200
43,TFBOYS快闪活动,183211
44,连那英都接不住的场子,180728
45,美依礼芽个人喜爱度第一,176918
46,杨和苏去婚礼走错地方,173835
47,快乐大本营最后一期未播预告,171882
48,张云雷首场演唱会纪录片,170689
49,比尔盖茨,168705
50,拥有好运体质是什么体验,164008
51,女生摆摊卖鸡脚边卖边吃,158377
