排名,标题,热度
1,TFBOYS十年之约演唱会官宣,6859188
2,吴倩退出乘风,2364060
3,杭州亚运形象宣传片弄潮,2340838
4,这次真的通知了他们仨,2334927
5,感觉这三个名字排在一起是上辈子的事,1477627
6,黄晓明油过没丑过,1131579
7,球迷冲进球场抱梅西,950514
8,苏翊鸣发文回应保送清华大学,928809
9,离职时我把工资告诉了同事,817849
10,交警买网红青蛙小青蛙不让付钱,784954
11,向佐郭碧婷为二胎儿子办周岁宴,778464
12,我老了追易烊千玺的样子,775144
13,私人山庄遭网红闯入并渲染成鬼屋,765889
14,时代峰峻,764398
15,袁弘 搞到梅西to签,608989
16,王俊凯王源易烊千玺转发十年之约演唱会,606184
17,黄晓明生图,583449
18,原来X光下的婴儿小手长这样,473245
19,新闻学教授怒怼张雪峰,383893
20,高校回应干部不正当男女关系被抓现行,314500
21,女导游穿紧身裤被质疑是色情营销,314494
22,快乐大本营最后一期未播预告,310046
23,考公上岸后被同学删了微信,308402
24,网友爆料宁艺卓是孟美岐导师,305584
25,女童吞下上百颗磁力珠肠道如鱼籽,304947
26,张元英穿了中国粉丝送的裙子,303320
27,TFBOYS的数字浪漫,299725
28,雪鹰领主今日定档,291195
29,薛之谦 再见啦梅西,279039
30,对你来说月薪1万够花吗,233444
31,冰清玉洁近况,233028
32,乘风帮唱师姐官宣,232748
33,头发居然可以扎进肉里,229849
34,54岁外卖员用4000首诗爱着这个世界,228016
35,女生摆摊卖鸡脚边卖边吃,227649
36,TFBOYS十周年联名,225374
37,连那英都接不住的场子,215431
38,TFBOYS要出新歌了吗,211663
39,肖战谈出道八年感悟,210848
40,比尔盖茨,203404
41,TFBOYS十年前出道形象片,202894
42,魔方吉尼斯纪录,201913
43,店老板回应帮被尾随女子解围,198412
44,赶时间的人也有诗和远方,195913
45,民警为查毒品剥开32吨洋葱,193976
46,四叶草过年了,191296
47,陈宏军叶芳离婚,191046
48,男子尾随女子欲强抱店铺众人解围,189316
49,阿根廷2比0,187339
50,迪丽热巴冷脸vs笑脸,185089
