排名,标题,热度
1,梅西回应到中国大部分时间待在酒店,1964106
2,吴倩方晒出院记录,1418060
3,杭州亚运村内部功能区首次公开亮相,1397035
5,嗯哼 追星成功太开心啦,1391528
6,偷偷藏不住定档,1266609
7,到底是谁惹了六公主,1264072
8,李飞P图不严谨啊,1041784
9,新闻学教授怒怼张雪峰,775710
10,交警买网红青蛙小青蛙不让付钱,657904
11,杜江问梅西嗯哼的签名照是真迹吗,425577
12,TFBOYS公式照,418952
13,Jennie去爬山了,403761
14,6女生写信控诉上大一研究生性剥削,382791
15,TFBOYS十年之约演唱会官宣,373475
16,离职时我把工资告诉了同事,367397
17,郭碧婷穿衣风格向太化,358522
18,我老了追易烊千玺的样子,324407
19,孙女辞职带患癌爷爷4年花10万游9省,260621
20,EDG康康五杀,259284
21,凌晨被室友在宿舍群里艾特,243633
22,人体含水量最多的器官,243424
23,女导游穿紧身裤被质疑是色情营销,242863
24,向佐郭碧婷为二胎儿子办周岁宴,242192
25,洞洞鞋的正确洗脚方法,241613
26,邓典果结婚,240906
27,阿玛尼粉底液,240061
28,就差杨幂了,239219
29,鹿晗北京站出座位了,238792
30,没十年功力都做不出这火锅,238012
31,张元英穿了中国粉丝送的裙子,237723
32,Angelababy欧阳娜娜金靖上海夜骑,236647
33,EDG惜败欧洲第一TL,236610
34,黄晓明提问比尔盖茨,235661
35,小孩子的创作力无需训练,198322
36,黄晓明油过没丑过,197801
37,高校一干部不正当男女关系被抓现行,196541
38,吴倩退出乘风,194346
39,偷偷藏不住,193133
40,刘雅瑟喝水vs张嘉倪喝水,191564
41,618直播闪降节爆款降到底,190967
42,东方神起 TMEA,190657
43,女儿高考完提出3个要求妈妈崩溃,190436
44,唐嫣演出古代才女的竹韵风骨,189565
45,TFBOYS13年vs23年,188741
46,杨和苏去婚礼走错地方,182544
47,考科目二因为没开空调挂了,179262
48,快乐大本营最后一期未播预告,176942
49,球迷冲进球场抱梅西,176664
50,赵露思马伯骞新剧演兄妹,176537
51,和神仙公司续签了5年合同,175885
