排名,标题,热度
1,TFBOYS十年之约演唱会官宣,9805193
2,这次真的通知了他们仨,4201949
3,杭州亚运会奖牌亮相,2789323
5,感觉这三个名字排在一起是上辈子的事,1755515
6,王俊凯王源易烊千玺转发十年之约演唱会,1546663
7,苏翊鸣发文回应保送清华大学,1043752
8,我老了追易烊千玺的样子,1042221
9,离职时我把工资告诉了同事,1031345
10,私人山庄遭网红闯入并渲染成鬼屋,957301
11,袁弘 搞到梅西to签,774467
12,时代峰峻,771875
13,向佐郭碧婷为二胎儿子办周岁宴,761512
14,快乐大本营最后一期未播预告,752780
15,球迷冲进球场抱梅西,730008
16,原来X光下的婴儿小手长这样,483109
17,黄晓明生图,481160
18,网友爆料宁艺卓是孟美岐导师,477219
19,女生摆摊卖鸡脚边卖边吃,445743
20,高校回应干部不正当男女关系被抓现行,400474
21,86岁和74岁的他们合力救起落水老太,398386
22,女导游穿紧身裤被质疑是色情营销,397624
23,乘风帮唱师姐官宣,395822
24,考公上岸后被同学删了微信,393925
25,TFBOYS要出新歌了吗,391835
26,苏醒见完梅西偶遇来迟的薛之谦,333361
27,连那英都接不住的场子,329569
28,TFBOYS十周年联名,329235
29,交警买网红青蛙小青蛙不让付钱,323444
30,四叶草过年了,309583
31,薛之谦 再见啦梅西,294957
32,陈宏军叶芳离婚,294538
33,迪丽热巴冷脸vs笑脸,293742
34,冰清玉洁近况,269068
35,你晚上一般睡多久,260070
36,关晓彤25岁身材管理,255285
37,民警为查毒品剥开32吨洋葱,236729
38,肖战李沁冬日拾光大片,231990
39,52岁大叔以身试险1小时劝退10多名游客,216133
40,对你来说月薪1万够花吗,211653
41,阿根廷2比0,210435
42,TFBOYS十年前出道形象片,210140
43,范丞丞晒一片菜叶生日面,210027
44,男子辞职在11家博物馆当讲解志愿者,209783
45,头发居然可以扎进肉里,200387
46,烟台让世界微醺,199666
47,鞠婧祎张新成合作新歌,198965
48,你会用公厕的纸巾吗,198216
49,奔跑吧今晚好梦靠选择,197738
50,比尔盖茨,189181
51,陈瑜元气打工人,189037
