排名,标题,热度
1,薛之谦 再见啦梅西,1663050
2,52岁大叔以身试险1小时劝退10多名游客,1291806
3,杭州亚运会奖牌亮相,1180058
5,朱珠浪姐结束后去HEC上学了,1163822
6,头发居然可以扎进肉里,1084306
7,球迷冲进球场抱梅西,1071334
9,陈宏军叶芳离婚,947207
10,冰清玉洁近况,877381
11,关晓彤25岁身材管理,810969
12,海底捞回应8块钱生菜仅2片,764233
13,女生摆摊卖鸡脚边卖边吃,746780
14,连那英都接不住的场子,621250
15,黄晓明生图,612969
16,你睡觉到底有多晚,558849
17,年入7万在江苏难不难,490893
18,苏醒见完梅西偶遇来迟的薛之谦,475060
19,梅西说别难为冲进场的球迷,464772
20,阿根廷2比0,362636
21,杨紫羊毛卷,303626
22,贺红玲被肖春生佟晓梅包围了,289734
23,男生中考忘涂机读卡妈妈大哭,287953
24,考公上岸后被同学删了微信,286758
25,六公主,283866
26,青2黄一鸣生女,281861
27,梅西81秒进球,260689
28,范丞丞23岁了,257576
29,一位韩国爸爸带女儿去夜店,253385
30,冲进球场抱梅西球迷面临什么处罚,232294
31,马嘉祺晒照为贺峻霖庆生,223891
32,梅西穿中文球衣,214388
33,离职时我把工资告诉了同事,214175
34,原来X光下的婴儿小手长这样,213017
35,集体越狱的萨摩耶宝宝,212177
36,研一和研三读文献时的区别,211830
37,阿根廷vs澳大利亚,210926
38,千万别为了省钱而花更多的钱,210473
39,肖春生佟晓梅情侣头像,209537
40,第一次感觉老头背心好帅,203864
41,高考结束发现被妈妈骗了,200669
42,张踩铃 当一个混血被双语幼儿园拒收,198803
43,第一次接吻时都会想些什么,198077
44,孟子义说曾舜晞我谈没谈你不知道吗,197018
45,校方回应地铁事件女子在科技作品署名,186378
46,张小斐说现在的红毯生图非常生,184209
47,嵩山音乐节 退票,173346
48,梅西过人好牛,173000
49,快乐大本营主持人现状,166530
50,董思成去看了梅西比赛,161867
51,过度打扮的女友和随意的男友,155399
52,吴宣仪晒和刘诗诗比耶合照,152234
