排名,标题,热度
1,陈乔恩被青蛙求婚,1347272
2,床垫上的保护膜到底用不用撕,837553
3,硬核科技铺就万桥飞架新坦途,748498
4,迪丽热巴真发了100多张自拍,748442
5,谢娜李维嘉吴昕录制新综艺,748269
6,水哥家的生态系统有多惊人,748085
7,白鹿张凌赫,682663
8,你见过最完美的户型,566518
9,四六级,444313
10,这就是我不敢去看中医的原因,354805
11,王宝强八角笼中首波口碑,353408
12,佟晓梅不幸感染肺炎,348223
13,陈冠希晒照祝欧阳娜娜生日快乐,344356
14,我的猫把孩子生到洗衣机了,337364
15,男子带68岁父亲第一次走出农村,336521
16,杜江问梅西嗯哼的签名照是真迹吗,328114
17,到底是谁惹了六公主,328009
18,宋仲基 成为父亲和丈夫会失去很多工作,294660
19,文旅部回应演唱会门票实名制,233111
20,中考,176733
21,我的大腿和男朋友的大腿,176627
22,秋瓷炫 我不是不要脸,176514
23,黄宗泽再认下去就不礼貌了,176226
24,原来近视是需要忌口的,176193
25,女导游穿紧身裤被质疑是色情营销,176019
26,王一博的手,175746
27,绝交视频是肖战拉着刘芮麟崔航拍的,175560
28,符合这几点你该离职了,175319
29,夹子音,175315
30,安踏 欧文,172596
31,当妈妈以为孩子会随自己的小体型时,172111
32,王霏霏到达上海,171323
33,冲进球场男子被行拘,170689
34,千万别在美容院暴露自己有钱,170523
35,莫兰特被禁赛25场,143251
36,六岁女孩为待产的聋哑父母做翻译,140314
37,领导叫我把升职机会让给别人,138192
38,柳智敏 艺人没时间是骗人的,136032
39,谢娜cue你好星期六,135810
40,袁姗姗一字肩高开叉礼服,122996
41,黄磊说把谢娜弄哭的次数不少,122861
42,村民鸡窝中发现鸟皇后,120926
43,偷偷藏不住换滤镜了,120560
44,梁洁少女感,116297
45,在哪个瞬间感受到了贫富差距,112494
46,钟辰乐泡泡,105628
47,四川医生真的在由衷的提建议,103558
48,还是那个王一博,99791
49,熊猫血女子坚持献血17年,99493
50,中文神曲用外语唱也挺魔性,98261
