排名,标题,热度
1,联合调查组认定饭菜中异物是鼠头,8637048
2,顶格处罚鼠头鸭脖涉事企业,2078297
3,奋进中国大江澎湃,1802048
5,四级,1559716
6,鼠头异物被涉事食堂事发当日丢弃,1489460
7,张雪峰 我离被人搞不远了,1375012
9,买洞洞鞋后这辈子就定型了,1222028
10,陈宏军居然出轨了,1158167
11,迪丽热巴照片有热带鱼表情,1015762
12,备孕前千万记得拔智齿,725512
13,指鼠为鸭,711890
14,为何鼠头曾被认定为鸭脖,701806
15,鼠头鸭脖事件院校删除此前声明,701573
16,男子受托帮接小孩未接上致孩子溺亡,682568
17,学生毕业典礼激情说唱我的祖国燃爆全场,675968
18,男子健身房内去世前向私教求救,673416
19,杨洋 新郎,541022
20,四级答案,453753
21,原著里的桑延vs剧版里的桑延,436167
22,马云在东京教书,430548
23,网友评选上半年烂剧之王,361224
24,已婚同事非要把她哥介绍给我,359990
25,月薪几万运营总监只会管鸡毛蒜皮,356297
26,还以为杨紫关晓彤在吵架,350829
27,四级难了 六级就不许了哦,336315
28,人不在学校却被抬到校长面前拨穗,330119
29,陈冠希晒照祝欧阳娜娜生日快乐,326139
30,迪丽热巴真发了100多张自拍,325285
31,床垫上的保护膜到底用不用撕,312645
32,白鹿张凌赫,291445
33,江西工业职业技术学院,258830
34,浪姐四公用了R1SE的青鸟,242732
35,偶像剧独爆小生,236068
36,王一博真的有听汪涵说的话,227975
37,四级翻译 难,218977
38,王宝强八角笼中首波口碑,211745
39,凌晨两点男同学和室友表白,203264
40,六公主连播易烊千玺主演电影,203101
41,鼠头鸭脖事件时间线,200346
42,室友给了假的考试重点,192826
43,舅舅私自处置孤女百万遗产被判赔130万,192674
44,TFBOYS是巡演吗,192268
45,同事付费坐我老公的车上下班,186183
46,肖春生转戒指,185298
47,与凤行,181071
48,四级作文,173639
49,70名考生坐船乘风破浪抵达考场,172605
50,EDG,172139
51,江西高校饭菜中异物不是鸭脖,163784
52,塞尔达连车门都能打开了,163712
