排名,标题,热度
1,联合调查组认定饭菜中异物是鼠头,6671351
2,买洞洞鞋后这辈子就定型了,1439921
3,奋进中国大江澎湃,1137485
5,陈宏军居然出轨了,1103351
6,四级,1004042
7,张雪峰 我离被人搞不远了,943683
8,迪丽热巴照片有热带鱼表情,831384
9,还以为杨紫关晓彤在吵架,624755
10,网友评选上半年烂剧之王,615386
11,男子健身房内去世前向私教求救,508069
12,顶格处罚鼠头鸭脖涉事企业,504550
13,杨洋 新郎,494066
14,男子受托帮接小孩未接上致孩子溺亡,490138
15,指鼠为鸭,489423
16,中学老师从10余米高桥跳河救起轻生女子,478895
17,鼠头异物被涉事食堂事发当日丢弃,477516
18,备孕前千万记得拔智齿,470922
19,偶像剧独爆小生,444206
20,为何鼠头曾被认定为鸭脖,435382
21,郑业成往车窗外乱丢烟头,425187
22,马云在东京教书,369346
23,鼠头鸭脖事件院校删除此前声明,369343
24,一颗老鼠头为何要省级调查组才能查清,369334
25,已婚同事非要把她哥介绍给我,309439
26,原著里的桑延vs剧版里的桑延,307669
27,女子骑车手扶帽子头部着地身亡,304101
28,谢娜捍卫张颂文歌手身份,303588
29,江西工业职业技术学院,284349
30,四级答案,282514
31,月薪几万运营总监只会管鸡毛蒜皮,278730
32,四级难了 六级就不许了哦,271993
33,床垫上的保护膜到底用不用撕,265194
34,陈冠希晒照祝欧阳娜娜生日快乐,250163
35,曾黎赵露思来现代演母女了,245480
36,贾静雯老公pick秋瓷炫,233172
37,白鹿张凌赫,220474
38,浪姐四公用了R1SE的青鸟,202461
39,凌晨两点男同学和室友表白,196565
40,王宝强八角笼中首波口碑,192795
41,与凤行,191728
42,迪丽热巴真发了100多张自拍,183492
43,伊能静儿子跳舞好好看,180385
44,何炅说终于轮到有人照顾我了,175632
45,同事付费坐我老公的车上下班,172061
46,王一博真的有听汪涵说的话,171046
47,肖春生转戒指,171010
48,林志玲后面是刘宪华,163832
49,星火英语,160622
50,EDG,160427
51,柳州胜利夜市,160400
