排名,标题,热度
1,谢娜李维嘉吴昕录制新综艺,1300713
2,你见过最完美的户型,469272
3,硬核科技铺就万桥飞架新坦途,430130
5,迪丽热巴真发了100多张自拍,388317
6,陈乔恩被青蛙求婚,351206
7,白鹿张凌赫,314126
8,到底是谁惹了六公主,302470
9,杜江问梅西嗯哼的签名照是真迹吗,230285
10,国外一女士住酒店遭遇撬门,204476
11,当丈夫说妻子在家啥也不干,197963
12,宋仲基 成为父亲和丈夫会失去很多工作,196063
13,黄宗泽再认下去就不礼貌了,194756
14,秋瓷炫 我不是不要脸,191358
15,孕妇高铁上突然生产众人接力救援,173059
16,小伙回应在国外将五星红旗解开,166007
17,吴倩方晒出院记录,144048
18,无穷小亮在旅途中拍到的震撼景色,142175
19,偷偷藏不住换滤镜了,135946
20,当我出门忘关16度的空调,111464
21,山西煤矿3死1伤事故监控曝光,90227
22,女导游穿紧身裤被质疑是色情营销,90174
23,村民鸡窝中发现鸟皇后,90082
24,原来近视是需要忌口的,89912
25,符合这几点你该离职了,89773
26,袁姗姗一字肩高开叉礼服,89736
27,郭碧婷穿衣风格向太化,89630
28,柳智敏 艺人没时间是骗人的,89429
29,绝交视频是肖战拉着刘芮麟崔航拍的,89360
30,一定要睡个好觉的原因,89269
31,冲进球场男子被行拘,89155
32,肖春生好懂佟晓梅,88177
33,王一博再戴麦穗胸针,87722
34,王宝强八角笼中首波口碑,84396
35,水哥家的生态系统有多惊人,78227
36,重庆潼南现千年巨型乌木,77494
37,男子带68岁父亲第一次走出农村,75047
38,TFBOYS演唱会投票,73000
39,肖春生问叶国华孩子几岁了,66445
40,两千三的工资面了三轮,65620
41,临期食品为什么受欢迎,65200
42,王一博抓金雨,64786
43,马伯骞并非难哄桑延选角,63317
44,过上了小说里的生活,61894
45,还是那个王一博,61593
46,穿袜子千万别穿洞洞鞋,58613
47,向太,55886
48,赵雅芝为王一博颁奖,50249
49,张靓颖的马甲线,49873
50,江苏一供电所开放院子给农民晒麦,45013
51,国足4比0战胜缅甸队,44716
