排名,标题,热度
1,买洞洞鞋后这辈子就定型了,2100575
2,顶格处罚鼠头鸭脖涉事企业,1805519
3,奋进中国大江澎湃,1441161
5,Jennie是前一天爬山太累了吗,1187101
6,长风渡定档,1016655
7,张雪峰 我离被人搞不远了,782200
8,备孕前千万记得拔智齿,718595
9,迪丽热巴照片有热带鱼表情,677588
10,网友评选上半年烂剧之王,652475
11,还以为杨紫关晓彤在吵架,565031
12,郑业成 希望大家不要效仿我的错误行为,552863
13,联合调查组认定饭菜中异物是鼠头,549036
14,向华强说以后珠宝都给郭碧婷,539679
15,伊能静儿子跳舞好好看,522047
16,70名考生坐船乘风破浪抵达考场,495201
17,一颗老鼠头为何要省级调查组才能查清,491654
18,陈宏军居然出轨了,486909
19,四级,479160
20,鼠身去哪了,415866
21,男子受托帮接小孩未接上致孩子溺亡,325292
22,马云在东京教书,305533
23,鼠头异物被涉事食堂事发当日丢弃,305048
24,王宝强八角笼中首波口碑,304317
25,月薪几万运营总监只会管鸡毛蒜皮,270127
26,公司的下午茶一个人4块钱,269530
27,胡锡进 希望鼠头鸭脖为全社会敲响警钟,264945
28,掌中宝,242556
29,女子骑车手扶帽子头部着地身亡,236488
30,杨洋 新郎,232968
31,鼠头鸭脖事件院校删除此前声明,192181
32,四级答案,190428
33,男子健身房内去世前向私教求救,190066
34,偶像剧独爆小生,188705
35,郑业成往车窗外乱丢烟头,182832
36,床垫上的保护膜到底用不用撕,179888
37,狐主任对蟑螂的态度,167549
38,叶国华叶芳是龙凤胎,167256
39,蔡徐坤应援灯提前亮了,158431
40,肖蓓蓓就是给肖战送信的女孩,158350
41,杨紫承欢记白西装,156773
42,原著里的桑延vs剧版里的桑延,152424
43,谢娜捍卫张颂文歌手身份,152306
44,江西工业职业技术学院,144773
45,林志玲后面是刘宪华,143807
46,肖春生静静看贺红玲表演,141222
47,陈雨菲,137549
48,40度,135702
49,怎么没有后浪,132188
50,陈冠希晒照祝欧阳娜娜生日快乐,127199
51,康康撞脸易建联,125364
