排名,标题,热度
1,谢娜李维嘉吴昕录制新综艺,487108
2,你见过最完美的户型,230779
3,硬核科技铺就万桥飞架新坦途,200623
4,迪丽热巴真发了100多张自拍,200094
5,白鹿张凌赫,199803
6,陈乔恩被青蛙求婚,199410
7,国外一女士住酒店遭遇撬门,156882
8,到底是谁惹了六公主,156362
9,孕妇高铁上突然生产众人接力救援,127642
10,当丈夫说妻子在家啥也不干,112647
11,秋瓷炫 我不是不要脸,108012
12,宋仲基 成为父亲和丈夫会失去很多工作,105028
13,小伙回应在国外将五星红旗解开,95616
14,杜江问梅西嗯哼的签名照是真迹吗,94417
15,黄宗泽再认下去就不礼貌了,76161
16,无穷小亮在旅途中拍到的震撼景色,71095
17,吴倩方晒出院记录,68355
18,山西煤矿3死1伤事故监控曝光,65828
19,当我出门忘关16度的空调,61568
20,柳智敏 艺人没时间是骗人的,61379
21,村民鸡窝中发现鸟皇后,60407
22,原来近视是需要忌口的,60065
23,女导游穿紧身裤被质疑是色情营销,58843
24,袁姗姗一字肩高开叉礼服,56724
25,符合这几点你该离职了,55975
26,郭碧婷穿衣风格向太化,55369
27,偷偷藏不住换滤镜了,55316
28,冲进球场男子被行拘,54622
29,一定要睡个好觉的原因,52240
30,王一博抓金雨,51838
31,向太,47022
32,王一博再戴麦穗胸针,46930
33,重庆潼南现千年巨型乌木,41977
34,TFBOYS演唱会投票,40688
35,赵雅芝为王一博颁奖,40070
36,两千三的工资面了三轮,37741
37,程潇 再热就不礼貌了,36345
38,穿袜子千万别穿洞洞鞋,35971
39,临期食品为什么受欢迎,34552
40,马伯骞并非难哄桑延选角,34302
41,蔡徐坤专辑,34300
42,国足4比0战胜缅甸队,34284
43,恋爱里的落差感,34275
44,林俊杰现场绝了,34255
45,张靓颖的马甲线,34244
46,宁安如梦超前营业,34228
47,黄晓明和宋慧乔演过情侣,34215
48,千万不要强行睁眼打喷嚏,34209
49,内娱还会有第二个TFBOYS吗,34184
50,中国女排vs保加利亚女排,34178
