排名,标题,热度
1,谢娜李维嘉吴昕录制新综艺,176873
2,到底是谁惹了六公主,134857
3,硬核科技铺就万桥飞架新坦途,120102
5,迪丽热巴真发了100多张自拍,118796
6,白鹿张凌赫,113911
7,陈乔恩被青蛙求婚,98755
8,你见过最完美的户型,74985
9,孕妇高铁上突然生产众人接力救援,46620
10,杜江问梅西嗯哼的签名照是真迹吗,45649
11,无穷小亮在旅途中拍到的震撼景色,44399
12,柳智敏 艺人没时间是骗人的,43940
13,秋瓷炫 我不是不要脸,42259
14,黄宗泽再认下去就不礼貌了,39442
15,国外一女士住酒店遭遇撬门,38706
16,当丈夫说妻子在家啥也不干,37500
17,宋仲基 成为父亲和丈夫会失去很多工作,37366
18,吴倩方晒出院记录,37284
19,当我出门忘关16度的空调,36459
20,小伙回应在国外将五星红旗解开,36361
21,山西煤矿3死1伤事故监控曝光,35925
22,女导游穿紧身裤被质疑是色情营销,35638
23,冲进球场男子被行拘,35331
24,偷偷藏不住换滤镜了,35188
25,原来近视是需要忌口的,34559
26,袁姗姗一字肩高开叉礼服,34090
27,一定要睡个好觉的原因,33208
28,TFBOYS演唱会投票,31976
29,符合这几点你该离职了,31629
30,郭碧婷穿衣风格向太化,29669
31,程潇 再热就不礼貌了,27760
32,千万不要强行睁眼打喷嚏,26602
33,王一博再戴麦穗胸针,26468
34,内娱还会有第二个TFBOYS吗,26343
35,马伯骞并非难哄桑延选角,26125
36,穿袜子千万别穿洞洞鞋,25609
37,张靓颖的马甲线,25609
38,少耶和我,25602
39,林俊杰现场绝了,25591
40,恋爱里的落差感,25588
41,重庆潼南现千年巨型乌木,25578
42,向太,25575
43,Jennie去爬山了,25570
44,EDG赛前海报,25561
45,王一博抓金雨,25552
46,黄晓明和宋慧乔演过情侣,25546
47,赵雅芝为王一博颁奖,25543
48,两千三的工资面了三轮,25539
49,临期食品为什么受欢迎,25531
50,中国女排vs保加利亚女排,25525
51,梅西回应到中国大部分时间待在酒店,25515
