排名,标题,热度
1,谢娜李维嘉吴昕录制新综艺,159494
2,到底是谁惹了六公主,149883
3,硬核科技铺就万桥飞架新坦途,146837
5,迪丽热巴真发了100多张自拍,146323
6,白鹿张凌赫,94406
7,陈乔恩被青蛙求婚,80184
8,你见过最完美的户型,67893
9,无穷小亮在旅途中拍到的震撼景色,42322
10,杜江问梅西嗯哼的签名照是真迹吗,38709
11,孕妇高铁上突然生产众人接力救援,37375
12,黄宗泽再认下去就不礼貌了,37152
13,国外一女士住酒店遭遇撬门,36792
14,秋瓷炫 我不是不要脸,35882
15,柳智敏 艺人没时间是骗人的,35574
16,宋仲基 成为父亲和丈夫会失去很多工作,35250
17,当丈夫说妻子在家啥也不干,34756
18,小伙回应在国外将五星红旗解开,33793
19,吴倩方晒出院记录,31708
20,当我出门忘关16度的空调,30333
21,山西煤矿3死1伤事故监控曝光,30270
22,女导游穿紧身裤被质疑是色情营销,30215
23,原来近视是需要忌口的,30138
24,冲进球场男子被行拘,30062
25,袁姗姗一字肩高开叉礼服,30010
26,一定要睡个好觉的原因,29968
27,符合这几点你该离职了,29563
28,TFBOYS演唱会投票,26447
29,偷偷藏不住换滤镜了,26434
30,王一博再戴麦穗胸针,26419
31,郭碧婷穿衣风格向太化,26383
32,王一博抓金雨,26370
33,程潇 再热就不礼貌了,26344
34,穿袜子千万别穿洞洞鞋,26329
35,向太,26297
36,千万不要强行睁眼打喷嚏,26283
37,Jennie去爬山了,26254
38,林俊杰现场绝了,26236
39,恋爱里的落差感,26214
40,重庆潼南现千年巨型乌木,26187
41,EDG赛前海报,26180
42,马伯骞并非难哄桑延选角,26151
43,内娱还会有第二个TFBOYS吗,26125
44,张靓颖的马甲线,26099
45,黄晓明和宋慧乔演过情侣,26088
46,少耶和我,26062
47,临期食品为什么受欢迎,26033
48,赵雅芝为王一博颁奖,26022
49,两千三的工资面了三轮,26011
50,无畏契约东京大师赛,25984
51,中国女排vs保加利亚女排,25966
