排名,标题,热度
1,舅舅私自处置孤女百万遗产被判赔130万,1382969
2,陈乔恩被青蛙求婚,1142577
3,硬核科技铺就万桥飞架新坦途,1040226
5,同事付费坐我老公的车上下班,1025038
6,床垫上的保护膜到底用不用撕,842579
7,迪丽热巴真发了100多张自拍,795693
9,水哥家的生态系统有多惊人,611589
10,谢娜李维嘉吴昕录制新综艺,573002
11,白鹿张凌赫,528232
12,文旅部回应演唱会门票实名制,483352
13,杨洋 新郎,478771
14,陈冠希晒照祝欧阳娜娜生日快乐,478477
15,我的猫把孩子生到洗衣机了,472198
16,王宝强八角笼中首波口碑,447345
17,马云在东京教书,391342
18,这就是我不敢去看中医的原因,390550
19,宋仲基 成为父亲和丈夫会失去很多工作,368823
20,你见过最完美的户型,360319
21,佟晓梅不幸感染肺炎,341023
22,四六级,339268
23,我的大腿和男朋友的大腿,339211
24,秋瓷炫 我不是不要脸,339006
25,到底是谁惹了六公主,328294
26,安踏 欧文,203761
27,男子带68岁父亲第一次走出农村,160777
28,贾静雯不知道黄晓明的明句梗,158846
29,张凌赫在奔跑吧喂白鹿吃东西,158387
30,王一博的手,157066
31,原来近视是需要忌口的,154544
32,胡锡进谈冲进球场男子被行拘,153974
33,主播为粉丝取快递内藏毒品被判无期,153371
34,当妈妈以为孩子会随自己的小体型时,153120
35,月薪几万运营总监只会管鸡毛蒜皮,151997
36,黄宗泽再认下去就不礼貌了,151945
37,用四川话教熊猫滑滑梯它能听懂吗,151208
38,杨洋男粉 我的神来啦,150507
39,梁洁少女感,149417
40,夹子音,149273
41,黄磊说把谢娜弄哭的次数不少,143223
42,符合这几点你该离职了,142024
43,杜江问梅西嗯哼的签名照是真迹吗,140157
44,快乐大本营小分队合体,136964
45,中考加油,135205
46,千万别在美容院暴露自己有钱,126253
47,港迪找到了下雨天保护大尾巴的办法,114845
48,女孩喝农药轻生民警大喊不准睡,114093
49,莫兰特被禁赛25场,113198
50,中考,111844
51,小胆毛冠鹿身卡护栏给自己折腾一身伤,106574
52,长护险让失能老人更安心,103439
