排名,标题,热度
1,联合调查组认定饭菜中异物是鼠头,5985443
2,买洞洞鞋后这辈子就定型了,1474628
3,奋进中国大江澎湃,1094856
5,陈宏军居然出轨了,906275
6,四级,786999
7,张雪峰 我离被人搞不远了,775422
9,网友评选上半年烂剧之王,737883
10,迪丽热巴照片有热带鱼表情,712170
11,还以为杨紫关晓彤在吵架,619418
12,备孕前千万记得拔智齿,591254
13,顶格处罚鼠头鸭脖涉事企业,568463
14,男子健身房内去世前向私教求救,501371
15,杨洋 新郎,430760
16,鼠头异物被涉事食堂事发当日丢弃,430437
17,中学老师从10余米高桥跳河救起轻生女子,417187
18,郑业成往车窗外乱丢烟头,416399
19,一颗老鼠头为何要省级调查组才能查清,405252
20,男子受托帮接小孩未接上致孩子溺亡,387029
21,伊能静儿子跳舞好好看,362138
22,鼠头鸭脖事件院校删除此前声明,361974
23,指鼠为鸭,361888
24,偶像剧独爆小生,361743
25,为何鼠头曾被认定为鸭脖,356413
26,马云在东京教书,346202
27,郑业成 希望大家不要效仿我的错误行为,339861
28,女子骑车手扶帽子头部着地身亡,296338
29,四级答案,273370
30,江西工业职业技术学院,269806
31,曾黎赵露思来现代演母女了,264093
32,月薪几万运营总监只会管鸡毛蒜皮,260693
33,谢娜捍卫张颂文歌手身份,254606
34,在睡梦中接收喵星信号,250166
35,陈冠希晒照祝欧阳娜娜生日快乐,249924
36,星火英语,243096
37,原著里的桑延vs剧版里的桑延,228835
38,饿了么发布100封求助信,211422
39,床垫上的保护膜到底用不用撕,206728
40,王宝强八角笼中首波口碑,194722
41,已婚同事非要把她哥介绍给我,193022
42,刷到这个狗狗视频合集哭了好久,189315
43,白鹿张凌赫,188545
44,贾静雯老公pick秋瓷炫,182193
45,叶国华叶芳是龙凤胎,180199
46,四级难了 六级就不许了哦,179195
47,杨紫承欢记白西装,178900
48,林志玲后面是刘宪华,174810
49,家可以常回但不能久待,172207
50,迪丽热巴真发了100多张自拍,162736
51,与凤行,157435
52,康康撞脸易建联,155866
