排名,标题,热度
1,霸王茶姬,1726694
2,大四男生实习薪资1万4妈妈仰天大笑,1596790
3,世界最高坝启动大坝浇筑,1060807
4,高铁上情侣想换座我拒绝了,946369
5,女孩涂鸦楼梯把爸爸感动哭,854764
6,东航客服回应胡兵50万积分被清零,840400
7,为什么阴干的衣服那么臭,680127
8,这背影居然是蔡少芬,673110
9,女朋友说她拍到我出轨了,668373
10,香港名媛蔡天凤葬礼今日举行,642785
11,鞠婧祎29岁身材管理,626606
12,公司回应发通知停聘川大毕业生,625361
13,宋佳居然这么高,607838
14,孟子义问郭麒麟认不认识德云社,536405
15,大学班主任哽咽送别毕业生,534067
16,护学爷爷要退休了,532334
17,教育局回应奔驰在操场倒车险撞人,532110
18,真情侣,506908
19,邓紫棋感染新冠,379068
20,长风渡守山河预告,344879
21,被录取了因体检不合格被刷,329102
22,肖战看到宝宝的反应,263500
23,白敬亭上小号夸自己,262129
24,赵露思拉陈哲远口罩,242306
25,我要给父亲打101分,242227
26,小猪崽紫,242224
27,向往的生活,235954
28,大奉打更人,229322
29,白敬亭宋轶今晚见,226722
30,蔡徐坤美甲上有字,215752
31,领导跟你说辛苦了千万别说没事不辛苦,208075
32,夫妻结婚生子后才知彼此是兄妹,205860
33,马嘉祺宋亚轩张真源ie分明,199411
34,狮子座真的很喜欢纯爱,195033
35,孟美岐演唱会票价,193441
36,RNG对战TES,190737
37,梦海大结局终于不刀了,186905
38,张雪峰 朋友对报考新传的建议,186876
39,AG对战VG,181881
40,河南一服务区菜盆中惊现老鼠,177720
41,中美外长会谈正式开始,164840
42,从上班背的包看上班时间,163788
43,周杰伦上海演唱会,161600
44,最酷的老爸,157222
45,上海中考数学,156665
46,康康哭了,149132
47,江西某中学学生疑似被老师要求弃考,147509
48,BLACKPINK新歌或将7月2日上线,145527
49,广末凉子丈夫道歉,141688
50,吃个粽子还挺费铁丝的,138222
