排名,标题,热度
1,孟美岐演唱会票价,1461082
2,小猪崽紫,982375
3,中国有约,973436
4,白敬亭上小号夸自己,973199
5,领导跟你说辛苦了千万别说没事不辛苦,972809
6,宋佳居然这么高,921672
7,薛之谦听谈到赵英俊强忍着眼泪,841469
8,康康哭了,771909
9,在我25岁时爸爸给我了一套房子的钥匙,541035
10,百果园回应女子团购西瓜被嘲讽,482915
11,粉丝偷梅西袜子,479124
12,邓紫棋感染新冠,477249
13,中美外长会谈正式开始,474632
14,白敬亭宋轶今晚见,467857
15,婴儿高烧40度昏迷交警紧急开道送医,455258
16,乐华,445789
17,孟美岐演唱会门票两天还没卖完,343454
18,江西工职院回应鼠头相关疑问,305430
19,偷偷藏不住OST阵容,303053
20,教育局回应奔驰在操场倒车险撞人,289430
21,被录取了因体检不合格被刷,288381
22,我主动说去领证男朋友的反应,285949
23,女生称洗澡后发现酒店房间有摄像头,282291
24,长风渡守山河预告,281433
25,室友在我的护发素里掺了脱毛膏,275433
26,入职后发现顶替怀孕同事工作,271502
27,秦岚王阳吻戏,265899
28,EDG淘汰世界冠军LOUD,256703
29,女生称没穿内衣取外卖被骑手骚扰,218732
30,专四,216248
31,胡兵50万积分被东航清零,213490
32,公司回应发通知停聘川大毕业生,211240
33,白轶补贴,208397
34,孙俪解决邓超疑问的方式,203272
35,半个奢侈品圈都在李宇春演唱会,201150
36,蔡徐坤虞书欣甘比母女合影,199629
37,曾黎赵丽颖新剧演师徒,196103
38,向往的生活,195712
39,布林肯访华,189299
40,父亲节祝福,186137
41,老人独自去看海公交司机默默陪一路,178187
42,张杰父亲节晒女儿打鼓视频,168081
43,ChaelusForever01 去世,166595
44,美国国务卿布林肯抵达北京,162749
45,父亲节,156699
46,女子住酒店赤身躺床男子刷卡进入,152217
47,Doinb想加入EDG,152177
48,有人用满头白发换你意气风发,140094
49,鼠头变鸭脖事件校方市场监管方将被追责,135875
50,专四 难,128865
