排名,标题,热度
1,孟美岐演唱会门票两天还没卖完,1537869
2,专四,1227660
3,中国有约,1115409
4,领导跟你说辛苦了千万别说没事不辛苦,1101355
5,白敬亭宋轶今晚见,1007960
6,薛之谦听谈到赵英俊强忍着眼泪,925965
7,蔡徐坤虞书欣甘比母女合影,923464
8,在我25岁时爸爸给我了一套房子的钥匙,831279
9,胡兵50万积分被东航清零,814055
10,父亲节,714545
11,秦岚王阳吻戏,664197
12,鼠头变鸭脖事件校方市场监管方将被追责,658330
13,承欢记开机,638724
14,看不懂pros and cons,577419
15,女生称洗澡后发现酒店房间有摄像头,576308
16,百果园回应女子团购西瓜被嘲讽,525693
17,在韩国比较吃香的中国女演员,491187
18,半个奢侈品圈都在李宇春演唱会,474500
19,与凤行首发剧照,443970
20,父亲节祝福,419629
21,入职后发现顶替怀孕同事工作,416227
22,女子住酒店赤身躺床男子刷卡进入,405481
23,孟美岐演唱会票价,384146
24,鹿晗演唱会,372032
25,美国国务卿布林肯抵达北京,355654
26,帮男朋友洗6年没有洗过的脏辫,348696
27,距拼多多今年618结束仅剩196天,320267
28,女生称没穿内衣取外卖被骑手骚扰,305420
29,室友在我的护发素里掺了脱毛膏,296792
30,西湖偶遇卖花郎送荷花,280203
31,王一博回眸氛围感,276717
32,人民检察院正式批捕孙准浩,273511
33,专四 难,260278
34,布林肯,248239
35,牛仔裤里的小兜是干嘛用的,234551
36,陈哲远偷吃沈月的饭,232086
37,专四阅读 来不及看,229300
38,被录取了因体检不合格被刷,221927
39,网文作家拒绝魔改亲自导演,210614
40,梦中的那片海今晚收官,208588
41,山东华测集团,193730
42,专四答案,184832
43,三体,182260
44,山东籍台湾老兵要把骨灰撒在故乡麦田,177262
45,当事人回应帮接小孩未接上致孩子溺亡,174353
46,谢娜 她她她,171362
47,TFBOYS十周年粉丝线下音乐会,160504
48,原来萌兰和花花的爸比都是美兰,155810
49,新来的实习生工资比我还高,143755
50,球迷冲进球场抱C罗,143621
