排名,标题,热度
1,专四,1872373
2,胡兵50万积分被东航清零,1721667
3,中国有约,970710
4,秦岚王阳吻戏,964456
5,薛之谦听谈到赵英俊强忍着眼泪,956223
6,蔡徐坤虞书欣甘比母女合影,929213
7,承欢记开机,920725
8,半个奢侈品圈都在李宇春演唱会,913375
9,父亲节,881444
10,女生称洗澡后发现酒店房间有摄像头,683965
11,鼠头变鸭脖事件校方市场监管方将被追责,678634
12,白敬亭宋轶今晚见,672448
13,在我25岁时爸爸给我了一套房子的钥匙,650900
14,百果园回应女子团购西瓜被嘲讽,526080
15,距拼多多今年618结束仅剩196天,498701
16,在韩国比较吃香的中国女演员,497074
17,谢娜 她她她,419560
18,女子为保护儿子连刺丈夫3刀判无罪,395712
19,童瑶抹胸上挂了68把钥匙,358170
20,父亲节祝福,348263
21,女生称没穿内衣取外卖被骑手骚扰,344418
22,入职后发现顶替怀孕同事工作,344045
23,牛仔裤里的小兜是干嘛用的,339107
24,专四作文,334072
25,帮男朋友洗6年没有洗过的脏辫,302404
26,陈哲远偷吃沈月的饭,291969
27,我和婚姻的战斗剧照故事感,286862
28,布林肯,281410
29,专四答案,261792
30,从医23年她换了一种方式守护患者,255624
31,三体,250612
32,端午公司发了3颗荔枝,234233
33,女子住酒店赤身躺床男子刷卡进入,233014
34,曾经的老板娘向我投了简历,227752
35,山东华测集团,205216
36,原来萌兰和花花的爸比都是美兰,197537
37,男朋友冷战后给我打钱,194519
38,TFBOYS十周年粉丝线下音乐会,191385
39,不提穷字但一听就很穷的话,175918
40,林允儿韩剧播出,170407
41,榜一大哥是我爸,167499
42,闪耀的她,164400
43,长风渡放个预告吧,163302
44,球迷冲进球场抱C罗,157351
45,人民检察院正式批捕孙准浩,151209
46,绝味鸭脖称终于沉冤得雪,150965
47,请不要再提示我这个密码太弱了,145679
48,萧敬腾方报警检测自证清白,144002
49,叶舒华演唱会神图,140780
50,甲亢哥见到C罗下跪膜拜,140021
