排名,标题,热度
1,榜一大哥是我爸,209733
2,萧敬腾方报警检测自证清白,132680
3,哪个瞬间你发现爸爸不再年轻,103443
5,端午公司发了3颗荔枝,98611
6,一颗老鼠头为何要省级调查组才能查清,95622
7,西工大一班级全员34人参与重大科研,73388
8,帮男朋友洗6年没有洗过的脏辫,72488
9,胡歌大鹏影帝双黄蛋,63087
10,张小斐嘴上说不热身体却很诚实,51791
11,jkl,51756
12,绝味鸭脖称终于沉冤得雪,51590
13,美国32岁男子让3个儿子站成一排枪杀,49830
14,谢娜 她她她,46942
15,黄渤上半身vs下半身,46055
16,憋屈了13年的猫猫终于翻身了,44753
17,梦海再现知否金句,43787
18,Jennie是前一天爬山太累了吗,42087
19,童瑶抹胸上挂了68把钥匙,37673
20,解说毛毛,34299
21,芝芙不热吗,33188
22,女生称没穿内衣取外卖被骑手骚扰,33185
23,女子住酒店赤身躺床男子刷卡进入,33183
24,突然明白了儿子为什么想回老家,33174
25,我有一栋楼 是要偷你什么东西,33171
26,有些衣服穿着穿着就变成睡衣了,33166
27,肖战的肌肉隔着衣服都能看到,33163
28,王一博黄渤跳舞,33161
29,杨幂杨紫的同款高跟鞋,33155
30,这猫是不是有点过于巨大了,33151
31,王一博让不出去的C位,33144
32,张远演唱会有男粉戴头纱,33142
33,谢娜说男生都会喜欢朱珠,33137
34,建议棣欣引力别看,33132
35,古巨基看了蔡徐坤演唱会,33125
36,中国文化在外国街头杀疯了,33125
37,陈绮贞音乐节,33118
38,去油版偷偷藏不住,33115
39,Uzi,33107
40,黑莲花 改名永夜星河,33105
41,六级,33103
42,TES 从业者也需要提升专业能力,33096
43,杨幂盘发梦回晴川,33091
44,范丞丞音乐节,33086
45,LNG战胜EDG,33081
46,想念朱婷,33081
47,电影一闪一闪亮晶晶,33074
48,看到姐姐们 不害怕变老了,33068
49,长风渡定档,33067
50,迪丽热巴 剪睫毛,33061
51,天津中考数学创新题,33055
