排名,标题,热度
1,大四男生实习薪资1万4妈妈仰天大笑,1548153
2,东航客服回应胡兵50万积分被清零,1282428
3,世界最高坝启动大坝浇筑,1162543
4,女朋友说她拍到我出轨了,1121744
5,教育局回应奔驰在操场倒车险撞人,909500
6,香港名媛蔡天凤葬礼今日举行,879838
7,肖战看到宝宝的反应,837380
8,这背影居然是蔡少芬,749820
9,宋佳居然这么高,675214
10,孟子义问郭麒麟认不认识德云社,667606
11,公司回应发通知停聘川大毕业生,645784
12,白敬亭上小号夸自己,604306
13,邓紫棋感染新冠,562640
14,真情侣,522894
15,领导跟你说辛苦了千万别说没事不辛苦,481665
16,小猪崽紫,448950
17,康康哭了,405925
18,孟美岐演唱会票价,365914
19,高铁上情侣想换座我拒绝了,318489
20,鲨我别用Victoria刀,301800
21,被录取了因体检不合格被刷,287390
22,白敬亭宋轶今晚见,269766
23,上海中考数学,241530
24,入职后发现顶替怀孕同事工作,239130
25,广末凉子丈夫道歉,238608
26,霸王茶姬,224297
27,长风渡守山河预告,224034
28,狮子座真的很喜欢纯爱,218832
29,中南财大毕业生捐出近5万奖学金,216628
30,中美外长会谈正式开始,211109
31,蔡徐坤美甲上有字,210189
32,杨紫牛骏峰同框路透,209623
33,孟美岐演唱会门票两天还没卖完,193203
34,南京Hero,188480
35,向往的生活,167216
36,Doinb想加入EDG,164054
37,周杰伦上海演唱会,163625
38,张真源量身高,156250
39,在我25岁时爸爸给我了一套房子的钥匙,155296
40,张杰演唱会到中场黄牛仍加价售卖,154038
41,夫妻结婚生子后才知彼此是兄妹,153036
42,与凤行编剧也是九鹭非香,151843
43,第一位打铁花的女性,142548
44,布林肯访华,141697
45,丁程鑫宋亚轩刘耀文湿发,138509
46,以前接电话vs现在接电话,134220
47,白轶补贴,133015
48,专四,132940
49,热射病,129806
50,李现内心OS我听不见,124168
