排名,标题,热度
1,父亲节,1542495
2,胡兵50万积分被东航清零,1194498
3,哪个瞬间你发现爸爸不再年轻,1096225
4,秦岚王阳吻戏,1090259
5,蔡徐坤虞书欣甘比母女合影,1037878
6,半个奢侈品圈都在李宇春演唱会,991955
7,白敬亭宋轶今晚见,855205
8,百果园回应女子团购西瓜被嘲讽,583277
9,女子为保护儿子连刺丈夫3刀判无罪,520161
10,帮男朋友洗6年没有洗过的脏辫,428931
11,鼠头变鸭脖事件校方市场监管方将被追责,425486
12,在韩国比较吃香的中国女演员,421925
13,谢娜 她她她,404569
14,绝味鸭脖称终于沉冤得雪,404380
15,三体,399112
16,距拼多多今年618结束仅剩196天,342856
17,父亲节祝福,327013
18,男子低血糖饿晕商户们霸总式投喂,321154
19,端午公司发了3颗荔枝,309139
20,榜一大哥是我爸,273833
21,入职后发现顶替怀孕同事工作,273505
22,女子住酒店赤身躺床男子刷卡进入,273377
23,女生称没穿内衣取外卖被骑手骚扰,273171
24,布林肯,272067
25,不提穷字但一听就很穷的话,269771
26,萧敬腾方报警检测自证清白,247650
27,曾经的老板娘向我投了简历,237222
28,林允儿韩剧播出,233574
29,海豹为了救人把整个家族都找过来,232463
30,请不要再提示我这个密码太弱了,217885
31,蔡徐坤演唱会,199682
32,球迷冲进球场抱C罗,192622
33,e人与i人拍照时的区别,182044
34,因为什么删了喜欢的人,164397
35,遭遇火灾如何安全快速逃生,164308
36,粽子也有显眼包了,164242
37,去医院急症要自己交空调费,160200
38,童瑶抹胸上挂了68把钥匙,159150
39,浪漫医生金师傅,148849
40,这猫是不是有点过于巨大了,141700
41,秦岚新剧今日开播,140113
42,六公主给胡歌红毯配仙一BGM,137180
43,母亲节vs父亲节,124238
44,央美学生毕设将课桌翻转变秋千,120880
45,王鹤棣偷拿零食投喂丁程鑫,117920
46,玩水滑梯被卡住是什么体验,106171
47,这就是无缝转场天花板吗,105519
48,宝宝见到爸爸1秒变脸,103845
49,黑莲花 改名永夜星河,103204
50,jkl,103113
