排名,标题,热度
1,孟美岐演唱会票价,1396517
2,教育局回应奔驰在操场倒车险撞人,1168629
3,宋佳居然这么高,1044862
4,白敬亭上小号夸自己,921415
5,领导跟你说辛苦了千万别说没事不辛苦,733574
6,小猪崽紫,643414
7,在我25岁时爸爸给我了一套房子的钥匙,613737
8,中美外长会谈正式开始,579552
9,邓紫棋感染新冠,558605
10,康康哭了,556946
11,干涸了半个世纪的青土湖如何复活,534916
12,乐华,519700
13,公司回应发通知停聘川大毕业生,492083
14,粉丝偷梅西袜子,477800
15,婴儿高烧40度昏迷交警紧急开道送医,451530
16,薛之谦听谈到赵英俊强忍着眼泪,440364
17,白敬亭宋轶今晚见,371558
18,女朋友说她拍到我出轨了,325496
19,孟美岐演唱会门票两天还没卖完,297899
20,香港名媛蔡天凤葬礼今日举行,296040
21,被录取了因体检不合格被刷,293221
22,室友在我的护发素里掺了脱毛膏,292485
23,Doinb想加入EDG,285434
24,入职后发现顶替怀孕同事工作,273120
25,白轶补贴,246086
26,长风渡守山河预告,221818
27,我主动说去领证男朋友的反应,195483
28,秦岚王阳吻戏,194112
29,广末凉子丈夫道歉,193049
30,陈雨菲夺赛季首冠,189687
31,胡兵50万积分被东航清零,189550
32,孟子义问郭麒麟认不认识德云社,189533
33,专四,189232
34,江西工职院回应鼠头相关疑问,188970
35,布林肯访华,185638
36,这背影居然是蔡少芬,185313
37,向往的生活,182956
38,中国有约,181690
39,女生称没穿内衣取外卖被骑手骚扰,180943
40,偷偷藏不住OST阵容,172742
41,女子住酒店赤身躺床男子刷卡进入,148361
42,张杰父亲节晒女儿打鼓视频,148330
43,父亲节祝福,146206
44,汤晶媚说孟子义敖瑞鹏穿的是情侣服,145316
45,百果园回应女子团购西瓜被嘲讽,139217
46,美国国务卿布林肯抵达北京,135965
47,ChaelusForever01 去世,127352
48,蔡徐坤虞书欣甘比母女合影,126005
49,被这个工作搭子整破防了,123879
50,父亲节,122246
