排名,标题,热度
1,专四,1918958
2,胡兵50万积分被东航清零,1672638
3,中国有约,1295397
4,薛之谦听谈到赵英俊强忍着眼泪,1107875
5,秦岚王阳吻戏,967420
6,蔡徐坤虞书欣甘比母女合影,917835
7,白敬亭宋轶今晚见,899714
8,父亲节,857601
9,在我25岁时爸爸给我了一套房子的钥匙,822309
10,女生称洗澡后发现酒店房间有摄像头,699774
11,鼠头变鸭脖事件校方市场监管方将被追责,641482
12,承欢记开机,627766
13,半个奢侈品圈都在李宇春演唱会,594604
14,在韩国比较吃香的中国女演员,532177
15,距拼多多今年618结束仅剩196天,525223
16,百果园回应女子团购西瓜被嘲讽,522003
17,专四作文,400281
18,父亲节祝福,398046
19,谢娜 她她她,379952
20,牛仔裤里的小兜是干嘛用的,373926
21,入职后发现顶替怀孕同事工作,363513
22,女生称没穿内衣取外卖被骑手骚扰,361910
23,女子住酒店赤身躺床男子刷卡进入,354687
24,帮男朋友洗6年没有洗过的脏辫,329537
25,孟美岐演唱会门票两天还没卖完,323078
26,女子为保护儿子连刺丈夫3刀判无罪,318462
27,布林肯,299964
28,童瑶抹胸上挂了68把钥匙,298585
29,陈哲远偷吃沈月的饭,284903
30,西湖偶遇卖花郎送荷花,278588
31,专四答案,274471
32,人民检察院正式批捕孙准浩,249858
33,曾经的老板娘向我投了简历,237753
34,三体,229474
35,端午公司发了3颗荔枝,218120
36,山东华测集团,217927
37,给狗子洗澡洗一半去找沐浴露,216320
38,我和婚姻的战斗剧照故事感,212531
39,TFBOYS十周年粉丝线下音乐会,208000
40,榜一大哥是我爸,180640
41,官方通报买1根牛肉干被偷塞5根称重,178778
42,林允儿韩剧播出,169264
43,不提穷字但一听就很穷的话,153102
44,原来萌兰和花花的爸比都是美兰,151936
45,长风渡放个预告吧,151022
46,球迷冲进球场抱C罗,147633
47,新传老师谈新闻专业报考争论,143969
48,绝味鸭脖称终于沉冤得雪,140427
49,萧敬腾方报警检测自证清白,133733
50,想见你韩版预告,129510
