排名,标题,热度
1,孟美岐演唱会票价,1488727
2,宋佳居然这么高,1115073
3,中国有约,1025521
4,白敬亭上小号夸自己,1019824
5,教育局回应奔驰在操场倒车险撞人,1001619
6,领导跟你说辛苦了千万别说没事不辛苦,804088
7,小猪崽紫,736015
8,康康哭了,676602
9,邓紫棋感染新冠,651424
10,在我25岁时爸爸给我了一套房子的钥匙,646849
11,乐华,635727
12,粉丝偷梅西袜子,616769
13,公司回应发通知停聘川大毕业生,606670
14,中美外长会谈正式开始,584338
15,婴儿高烧40度昏迷交警紧急开道送医,545285
16,薛之谦听谈到赵英俊强忍着眼泪,541419
17,陈雨菲夺赛季首冠,410766
18,白敬亭宋轶今晚见,409722
19,孟美岐演唱会门票两天还没卖完,288095
20,Doinb想加入EDG,265043
21,被录取了因体检不合格被刷,261595
22,室友在我的护发素里掺了脱毛膏,252702
23,入职后发现顶替怀孕同事工作,251443
24,我主动说去领证男朋友的反应,241870
25,江西工职院回应鼠头相关疑问,241294
26,长风渡守山河预告,235365
27,白轶补贴,210101
28,秦岚王阳吻戏,207950
29,向往的生活,199477
30,百果园回应女子团购西瓜被嘲讽,197926
31,胡兵50万积分被东航清零,197426
32,香港名媛蔡天凤葬礼今日举行,197293
33,孟子义问郭麒麟认不认识德云社,196930
34,专四,196507
35,偷偷藏不住OST阵容,192140
36,女生称没穿内衣取外卖被骑手骚扰,177992
37,女朋友说她拍到我出轨了,174338
38,女子住酒店赤身躺床男子刷卡进入,171653
39,张杰父亲节晒女儿打鼓视频,170524
40,父亲节祝福,152507
41,汤晶媚说孟子义敖瑞鹏穿的是情侣服,151884
42,女生称洗澡后发现酒店房间有摄像头,147416
43,布林肯访华,145987
44,孙俪解决邓超疑问的方式,145883
45,蔡徐坤虞书欣甘比母女合影,141171
46,美国国务卿布林肯抵达北京,136767
47,ChaelusForever01 去世,134744
48,半个奢侈品圈都在李宇春演唱会,124790
49,父亲节,124207
50,张婧仪惜花芷大婚造型,119486
