排名,标题,热度
1,胡兵50万积分被东航清零,1528538
2,半个奢侈品圈都在李宇春演唱会,1398931
3,哪个瞬间你发现爸爸不再年轻,1261054
4,秦岚王阳吻戏,1142958
5,蔡徐坤虞书欣甘比母女合影,1061431
6,父亲节,1040100
7,白敬亭宋轶今晚见,921628
8,百果园回应女子团购西瓜被嘲讽,598290
9,女子为保护儿子连刺丈夫3刀判无罪,461057
10,父亲节祝福,368401
11,鼠头变鸭脖事件校方市场监管方将被追责,365863
12,薛之谦听谈到赵英俊强忍着眼泪,364206
13,在韩国比较吃香的中国女演员,359770
14,谢娜 她她她,358019
15,帮男朋友洗6年没有洗过的脏辫,355812
16,三体,345372
17,绝味鸭脖称终于沉冤得雪,341435
18,端午公司发了3颗荔枝,324813
19,布林肯,279295
20,牛仔裤里的小兜是干嘛用的,238394
21,入职后发现顶替怀孕同事工作,238339
22,女生称没穿内衣取外卖被骑手骚扰,238272
23,女子住酒店赤身躺床男子刷卡进入,238112
24,不提穷字但一听就很穷的话,238053
25,肖战谈梦海对自己的意义,237908
26,曾经的老板娘向我投了简历,237782
27,林允儿韩剧播出,237746
28,球迷冲进球场抱C罗,200744
29,萧敬腾方报警检测自证清白,200116
30,7只小可爱养好身体重返大自然,193740
31,在我25岁时爸爸给我了一套房子的钥匙,193738
32,女生称洗澡后发现酒店房间有摄像头,193737
33,童瑶抹胸上挂了68把钥匙,193729
34,榜一大哥是我爸,187997
35,男朋友冷战后给我打钱,184922
36,海豹为了救人把整个家族都找过来,168896
37,男朋友的头发可是情侣共同财产,158102
38,今天的第一条信息会发给爸爸吗,153131
39,请不要再提示我这个密码太弱了,152489
40,家里不养闲猫,150881
41,TFBOYS十周年粉丝线下音乐会,149666
42,上海暴雨,145581
43,临汾地震,144711
44,因为什么删了喜欢的人,136173
45,e人与i人拍照时的区别,131484
46,男子低血糖饿晕商户们霸总式投喂,130659
47,这猫是不是有点过于巨大了,130659
48,距拼多多今年618结束仅剩196天,130619
49,jkl,130555
50,葡萄牙3比0波黑,130542
