排名,标题,热度
1,专四,1761895
2,胡兵50万积分被东航清零,1307525
3,中国有约,1215300
4,孟美岐演唱会门票两天还没卖完,1159930
5,蔡徐坤虞书欣甘比母女合影,915003
6,承欢记开机,858020
7,在我25岁时爸爸给我了一套房子的钥匙,811844
8,秦岚王阳吻戏,810610
9,父亲节,752530
10,女生称洗澡后发现酒店房间有摄像头,682468
11,鼠头变鸭脖事件校方市场监管方将被追责,665015
12,白敬亭宋轶今晚见,640330
13,薛之谦听谈到赵英俊强忍着眼泪,624255
14,半个奢侈品圈都在李宇春演唱会,596179
15,距拼多多今年618结束仅剩196天,517165
16,专四 难,497165
17,看不懂pros and cons,477372
18,在韩国比较吃香的中国女演员,462413
19,与凤行首发剧照,408240
20,父亲节祝福,402764
21,入职后发现顶替怀孕同事工作,385908
22,女子住酒店赤身躺床男子刷卡进入,382385
23,帮男朋友洗6年没有洗过的脏辫,365878
24,牛仔裤里的小兜是干嘛用的,360070
25,百果园回应女子团购西瓜被嘲讽,357548
26,女生称没穿内衣取外卖被骑手骚扰,333244
27,布林肯,320733
28,人民检察院正式批捕孙准浩,289337
29,陈哲远偷吃沈月的饭,285439
30,西湖偶遇卖花郎送荷花,249279
31,领导跟你说辛苦了千万别说没事不辛苦,248860
32,新来的实习生工资比我还高,245979
33,谢娜 她她她,239837
34,室友在我的护发素里掺了脱毛膏,237398
35,山东华测集团,233181
36,专四答案,208907
37,女子为保护儿子连刺丈夫3刀判无罪,208210
38,TFBOYS十周年粉丝线下音乐会,204154
39,三体,201241
40,童瑶抹胸上挂了68把钥匙,192535
41,端午公司发了3颗荔枝,185617
42,给狗子洗澡洗一半去找沐浴露,181951
43,曾经的老板娘向我投了简历,174903
44,原来萌兰和花花的爸比都是美兰,168574
45,想见你韩版预告,157371
46,长风渡放个预告吧,148704
47,父亲节来炫父,147952
48,林允儿韩剧播出,135379
49,男朋友冷战后给我打钱,133103
50,球迷冲进球场抱C罗,130353
