排名,标题,热度
1,大四男生实习薪资1万4妈妈仰天大笑,2065353
2,东航客服回应胡兵50万积分被清零,1149913
3,世界最高坝启动大坝浇筑,1094603
4,霸王茶姬,1084922
5,女朋友说她拍到我出轨了,1039630
6,香港名媛蔡天凤葬礼今日举行,801161
7,肖战看到宝宝的反应,777300
8,这背影居然是蔡少芬,755642
9,教育局回应奔驰在操场倒车险撞人,752058
10,高铁上情侣想换座我拒绝了,643869
11,公司回应发通知停聘川大毕业生,643268
12,宋佳居然这么高,642344
13,真情侣,630862
14,孟子义问郭麒麟认不认识德云社,519300
15,邓紫棋感染新冠,458083
16,领导跟你说辛苦了千万别说没事不辛苦,438845
17,白敬亭上小号夸自己,437787
18,小猪崽紫,406901
19,康康哭了,399770
20,孟美岐演唱会票价,332151
21,被录取了因体检不合格被刷,317596
22,鞠婧祎29岁身材管理,290174
23,长风渡守山河预告,259820
24,入职后发现顶替怀孕同事工作,254244
25,白敬亭宋轶今晚见,249022
26,蔡徐坤美甲上有字,244748
27,鲨我别用Victoria刀,220631
28,电影热烈首波口碑,213011
29,上海中考数学,211448
30,狮子座真的很喜欢纯爱,205846
31,张杰链条背带,202996
32,广末凉子丈夫道歉,194307
33,夫妻结婚生子后才知彼此是兄妹,194120
34,赵露思拉陈哲远口罩,193128
35,向往的生活,179918
36,杨紫牛骏峰同框路透,177171
37,孟美岐演唱会门票两天还没卖完,173023
38,中美外长会谈正式开始,163028
39,南京Hero,144316
40,Doinb想加入EDG,136103
41,你被梦海里的哪句台词打动了,135565
42,张杰演唱会到中场黄牛仍加价售卖,133966
43,周杰伦上海演唱会,132381
44,布林肯访华,131122
45,延边大学美食节Love Scenario,130545
46,白轶补贴,130077
47,张雪峰 朋友对报考新传的建议,120646
48,以前接电话vs现在接电话,119576
49,热射病,113775
50,在我25岁时爸爸给我了一套房子的钥匙,101526
