排名,标题,热度
1,黄子佼曝大小S吸毒,13920718
2,虞书欣王鹤棣 二搭,1556626
3,国内首座跨海高速铁路桥大片,1251688
4,拍一部爆一部的演员,1169779
5,张小斐首部女主电视剧,1000526
6,鼠头鸭脖涉事母公司经营700多个高校食堂,965549
7,Jennie巡演翻白眼,892719
8,警方确认女子房子被邻居打通使用,845593
9,客户让高中女儿多看招聘网,462774
10,班主任暗示初三学生弃考情况属实,358102
11,黄子佼承认性骚扰,356899
12,黄子佼拿刀割自己,356011
13,阿雅否认吸毒,355893
14,幼师拍小朋友房车钱视频引争议,354616
15,和章子怡一起不设限,315843
16,阿雅,313662
17,范晓萱,313239
18,蟑螂飞到耳朵里还咬出血,307269
19,初中生早课犯困老师空1节课让休息,303867
20,大四男生实习薪资1万4妈妈仰天大笑,279485
21,黄子佼信息炸裂,278010
22,大小S经纪人否认黄子佼指控,273878
23,因为口癖是老公社死了,265331
24,千万不要在教资体检时穿裙子,260135
25,一天之内拒绝了30个学生请假,257238
26,张兰直播,253486
27,黄子佼被送往医院,248337
28,黄子佼老婆,244386
29,猎罪图鉴2来了,238712
30,00后女孩辞职开馒头店一个卖五六块,236758
31,周俊伟,232057
32,周深美依礼芽终于合作上了,231403
33,原来真的有人发际线连着眉毛,228783
34,专八,224617
35,湖南女孩从中职生逆袭到博士,218249
36,马思纯扇巴掌戏被打到闭眼,216106
37,白敬亭吃醋不像演的,215851
38,星宇道歉,212345
39,为什么推荐6月21日提离职,212149
40,南京小龙虾卖100块一只值吗,208949
41,偷偷藏不住连更10天,207877
42,张杰演唱会现场喊话黄牛,207707
43,本周仅上4天班,206608
44,长相思谁是杨紫的新郎,206600
45,与凤行预告,206593
46,腾讯今天物料好多,206585
47,男子地铁上疑指责女孩穿着暴露引争执,206573
48,星宇,206567
49,演唱会座位脏,206557
50,北京WB,206549
