排名,标题,热度
1,大S工作室回应吸毒指控,10730221
2,庆余年,1359198
3,夏日中国每一帧都是限定壁纸,1257672
4,老父亲手机被女儿没收离家出走,1249098
5,哈工大的这张毕业车票让人破防了,1242931
6,张晚意今天官宣了三部剧,1241759
7,女孩遇大叔舞龙热情喊话再来一次,1067172
8,石矶娘娘来了也穿不了,927827
9,黄子佼曝大小S吸毒,920875
10,演唱会座位脏,913633
11,黄子佼拿刀割自己,913628
12,吴宗宪称将起诉黄子佼,911425
13,腾讯变汪峰,909369
14,布林肯访华,895369
15,霍建华复出后首部作品,882318
16,黄子佼信息炸裂,862275
17,黄子佼承认性骚扰,824628
18,阿雅否认吸毒,811892
19,鼠头鸭脖涉事母公司经营700多个高校食堂,767549
20,调查称53.7%年轻人存款不足10万,630463
21,周俊伟,589846
22,每个月工资8000但闲的发慌,521865
23,结婚五年面相都变了,519333
24,星宇道歉,429267
25,警方确认女子房子被邻居打通使用,334045
26,黄子佼老婆,333999
27,黄子佼被送往医院,333930
28,范晓萱,333897
29,南京小龙虾卖100块一只值吗,333827
30,当你的合租室友带音箱洗澡,333727
31,拍一部爆一部的演员,333663
32,虞书欣王鹤棣 二搭,333621
33,肖战骄阳伴我双平台播出,333530
34,张小斐首部女主电视剧,333522
35,王者荣耀,333395
36,Jennie巡演翻白眼,333346
37,幼师拍小朋友房车钱视频引争议,333276
38,你太用力了所以走不远,333254
39,为什么夏天很少见到男生打伞,333151
40,长得不漂亮但拍照上镜,333120
41,赵丽颖新剧自称本王,333065
42,萧敬腾,332997
43,邓科 大奉打更人,332914
44,原来真的有人发际线连着眉毛,332832
45,猎罪图鉴2来了,332757
46,应采儿陈小春假装不认识Jasper,332699
47,骄阳伴我,332634
48,因为口癖是老公社死了,332612
49,不到10天浙江母女先后确诊这种癌,332493
50,班主任暗示初三学生弃考情况属实,332483
