排名,标题,热度
1,庆余年,2319456
2,哈工大的这张毕业车票让人破防了,1673237
3,夏日中国每一帧都是限定壁纸,1279109
4,霍建华复出后首部作品,1238608
5,恐高辅警11楼救下轻生男子,1126897
6,大S工作室回应吸毒指控,1116951
7,女孩遇大叔舞龙热情喊话再来一次,1103930
8,庆余年2官宣阵容,1093066
9,肖战骄阳伴我双平台播出,978280
10,石矶娘娘来了也穿不了,856097
11,黄子佼拿刀割自己,843892
12,演唱会座位脏,735294
13,调查称53.7%年轻人存款不足10万,684656
14,黄子佼曝大小S吸毒,661616
15,男童深夜独自乘车司机果断报警,628334
16,葛斯齐 曝光内容百分之九十五相符,576537
17,黄子佼信息炸裂,554549
18,吴宗宪称将起诉黄子佼,498952
19,黄子佼承认性骚扰,461896
20,鼠头鸭脖涉事母公司经营700多个高校食堂,456938
21,腾讯变汪峰,434842
22,每个月工资8000但闲的发慌,417105
23,结婚五年面相都变了,400988
24,布林肯访华,379128
25,南京小龙虾卖100块一只值吗,355210
26,周俊伟,354288
27,应采儿陈小春假装不认识Jasper,353529
28,张晚意今天官宣了三部剧,351704
29,你太用力了所以走不远,350379
30,警方确认女子房子被邻居打通使用,349313
31,阿雅否认吸毒,347899
32,黄子佼老婆,347660
33,庆余年2好多美女,346517
34,雅思四个9的越南人,344530
35,不到10天浙江母女先后确诊这种癌,344105
36,范晓萱,342868
37,虞书欣王鹤棣 二搭,341665
38,星宇道歉,339886
39,王者荣耀,338720
40,原来真的有人发际线连着眉毛,337291
41,Jennie巡演翻白眼,336608
42,拍一部爆一部的演员,335595
43,庆余年叶灵儿,334115
44,长风渡,333178
45,张小斐首部女主电视剧,319151
46,猎罪图鉴2来了,317070
47,赵丽颖新剧自称本王,308131
48,老父亲手机被女儿没收离家出走,303114
49,因为口癖是老公社死了,298539
50,长得不漂亮但拍照上镜,292404
