排名,标题,热度
1,989大学,853573
2,迪丽热巴手滑进了梦海直播间,589404
3,三夏农忙正当时,586022
4,建议魏大勋别看,584800
5,真的别再关灯玩手机了,573397
6,女儿考满分农民工父亲买了只烧鸡庆祝,446933
7,大四男生实习薪资1万4妈妈仰天大笑,350570
8,厦大新闻学教授谈张雪峰言论,337255
9,女朋友说她拍到我出轨了,300331
10,胡可三演白敬亭丈母娘,275843
11,东航客服回应胡兵50万积分被清零,246617
12,内蒙古城管执法中队负责人出轨女下属,213531
13,为什么阴干的衣服那么臭,211230
14,白敬亭宋轶对视没有技巧全是感情,190413
15,高铁上情侣想换座我拒绝了,182942
16,王阳好会亲,172009
17,千万不要在这里装洞洞鞋鞋花,167949
18,Jennie在舞台上走神,165487
19,长风渡首播反馈,141713
20,中美外长会谈结束,123930
21,朴彩英四年前的发量vs现在的,115008
22,布林肯,110081
23,相亲中的聊天记录,108921
24,想提离职结果被公司辞退了,107993
25,鞠婧祎29岁身材管理,107433
26,这背影居然是蔡少芬,103834
27,等会这是猫最后一条命了,96983
28,白桃星座,94665
29,Dream一个肖战李沁六搭,92558
30,白轶补贴情头,87552
31,如何婉转的告诉他已经上课了,87236
32,18岁出考场vs23岁出考场,85798
33,CCTV8剧说很好看,84595
34,有点担心与凤行剧情了,83323
35,李荣浩去了杨丞琳演唱会,78619
36,歌手演唱会价格一览,71727
37,鬼灭之刃,70963
38,五月天告五人,70650
39,游客称玛雅海滩水公园泳池现卫生巾,68512
40,清华大学vs广东工大,66145
41,李现松弛感,65739
42,梦中的那片海央视剧照,65322
43,一个人爱你的最高形式,64297
44,长风渡,63441
45,虞书欣丁禹兮 永夜星河,63113
46,田曦薇大奉打更人,57991
47,你会请三休八拼长假吗,51621
48,生活中的安全小常识,50692
49,武汉暴雨,49890
50,王鹤棣许七安,49070
