排名,标题,热度
1,朱一龙爸爸,1620272
2,庆余年2官宣阵容,1092577
3,高质量发展调研行,752887
4,王源回应妈妈进不去自己的演唱会,672932
5,调查称53.7%年轻人存款不足10万,646457
6,大S工作室回应吸毒指控,616178
7,张晚意今天官宣了三部剧,527241
8,女子称母亲到派出所接受询问后死亡,525794
9,五星红旗被捆绑酒店连说10句对不起,521594
10,石矶娘娘来了也穿不了,517858
11,小S和舞蹈老师视频,512043
12,马云指出淘宝天猫未来三个方向,509524
13,胡锡进 川大那名女生的事该有结果了,505173
14,黄子佼信息炸裂,502109
15,轮椅老人坐公交司机乘客抢着帮忙,498903
16,黄子佼曝大小S吸毒,492977
17,只要你吸毒就会被发现,490058
18,经常锻炼与不锻炼的人大腿肌肉的对比,487067
19,周雨结婚,480316
20,吴宗宪曝黄子佼曾要求女生脱衣验身,478416
21,黄子佼拿刀割自己,476241
22,庆余年叶灵儿,469095
23,世纪大和解是演的吗,466167
24,每个月工资8000但闲的发慌,463383
25,结婚五年面相都变了,460566
26,腾讯变汪峰,459845
27,唐梓结婚,456077
28,赵敏周芷若同框了,451764
29,澳大利亚一男子持刀入室抢劫被奸杀,444410
30,布林肯访华,440300
31,范晓萱,436797
32,周俊伟,434650
33,倪妮被文咏珊撩到脸红,431286
34,霍建华复出后首部作品,375144
35,你是一具受潮的木乃伊,351331
36,长风渡,347938
37,网友拍到的龙吸水,347001
38,女幼师给幼儿喂避孕药,343161
39,这水龙头有毛病吧,342240
40,在一起很久后必须分开的情况,339129
41,虞书欣王鹤棣 二搭,337469
42,肖战点赞比心视频,335077
43,本次白玉兰不排除有双黄蛋,310056
44,长风渡婚礼,307853
45,林志颖,276968
46,你太用力了所以走不远,275888
47,印尼vs阿根廷,273010
48,被爱意包围的小狗,268795
49,演唱会座位脏,264018
50,我们小狗最看重朋友了,262548
