排名,标题,热度
1,鼠头鸭脖涉事母公司经营700多个高校食堂,2465170
2,猎罪图鉴2来了,1793496
3,三夏农忙正当时,1314687
4,顾漫马甲,1290109
5,大四男生实习薪资1万4妈妈仰天大笑,1280283
6,班主任暗示初三学生弃考情况属实,1209816
7,马思纯扇巴掌戏被打到闭眼,1170367
8,为什么推荐6月21日提离职,1058207
9,张杰演唱会现场喊话黄牛,847854
10,本周仅上4天班,733457
11,南京小龙虾卖100块一只值吗,713922
12,沙溢胡可情头,698694
13,猎罪图鉴2求原班人马,601790
14,幼师拍小朋友房车钱视频引争议,588297
15,Jennie在舞台上走神,576559
16,肖战赵丽颖正剧苗子,526268
17,妹子抗争五年德国终于答应归还文物,506319
18,长相思谁是杨紫的新郎,498021
19,专八,448027
20,王阳用口红在秦岚脸上留号码,436772
21,千万不要在教资体检时穿裙子,434876
22,化学老师跳下10米高桥救起轻生女子,430352
23,鹿晗金色脏辫,427552
24,肖战腹肌好明显,412584
25,女子房子两年没住被邻居用衣柜封死,387030
26,十年前当了蔡依林甲方,384832
27,鹅厂2023大剧片单,368859
28,Jennie金泰亨都去看了火星哥演唱会,362887
29,郑钧吐槽刘芸新剧角色,346220
30,狗狗被陌生男子下药后拼命爬回家,316615
31,白敬亭吃醋不像演的,314563
32,一天之内拒绝了30个学生请假,310495
33,坐飞机发现前男友的座位在旁边,295211
34,白敬亭想改的名字都被注册了,286742
35,星宇,282575
36,林志颖活动照,280622
37,长相思,273902
38,因为口癖是老公社死了,272635
39,南宁地铁推倒女站务员男子已被行拘,254099
40,张晚意任敏 锦绣安宁,253148
41,折腰,219062
42,白玉兰,216307
43,宋祖儿刘宇宁身高差cp感,211460
44,美国珍珠鳖放生太湖,202963
45,好多明星出发时装周,197042
46,蔡徐坤hugme开场,196607
47,王毅布林肯会面,174032
48,989大学,173684
49,单身不要跟父母出去参加婚礼,173363
50,不像刚学的像在吃老本,172865
