排名,标题,热度
1,朱一龙爸爸,1512184
2,庆余年2官宣阵容,1167920
3,高质量发展调研行,914375
4,王源回应妈妈进不去自己的演唱会,791019
5,调查称53.7%年轻人存款不足10万,634793
6,大S工作室回应吸毒指控,610678
7,张晚意今天官宣了三部剧,564767
8,马云指出淘宝天猫未来三个方向,518395
9,女子称母亲到派出所接受询问后死亡,517859
10,五星红旗被捆绑酒店连说10句对不起,512339
11,小S和舞蹈老师视频,509665
12,经常锻炼与不锻炼的人大腿肌肉的对比,505099
13,胡锡进 川大那名女生的事该有结果了,499258
14,黄子佼信息炸裂,493443
15,轮椅老人坐公交司机乘客抢着帮忙,490074
16,黄子佼曝大小S吸毒,488120
17,只要你吸毒就会被发现,479760
18,黄子佼拿刀割自己,476276
19,周雨结婚,472402
20,吴宗宪曝黄子佼曾要求女生脱衣验身,470786
21,腾讯变汪峰,464214
22,庆余年叶灵儿,459289
23,每个月工资8000但闲的发慌,456571
24,结婚五年面相都变了,453934
25,石矶娘娘来了也穿不了,453785
26,唐梓结婚,452890
27,赵敏周芷若同框了,451819
28,范晓萱,450855
29,澳大利亚一男子持刀入室抢劫被奸杀,450677
30,布林肯访华,415928
31,倪妮被文咏珊撩到脸红,415886
32,周俊伟,415681
33,肖战和肖春生的异同点,415444
34,你是一具受潮的木乃伊,389193
35,网友拍到的龙吸水,380144
36,长风渡,378670
37,虞书欣王鹤棣 二搭,368454
38,我们小狗最看重朋友了,368220
39,公司发了400端午过节费,368085
40,在一起很久后必须分开的情况,368010
41,霍建华复出后首部作品,367995
42,肖战点赞比心视频,348965
43,山东一市机关单位免费开放停车场,317475
44,本次白玉兰不排除有双黄蛋,294732
45,这水龙头有毛病吧,289002
46,长风渡婚礼,287890
47,庆余年2好多美女,284894
48,林志颖,269863
49,印尼vs阿根廷,191097
50,你太用力了所以走不远,184834
