排名,标题,热度
1,一天之内拒绝了30个学生请假,1799925
2,本周仅上4天班,1630350
3,三夏农忙正当时,1049082
4,南宁地铁推倒女站务员男子已被行拘,972841
5,肖战赵丽颖正剧苗子,942470
6,鹿晗金色脏辫,775957
7,白敬亭想改的名字都被注册了,771872
8,厦大新闻学教授谈张雪峰言论,729358
9,Jennie金泰亨都去看了火星哥演唱会,677360
10,白敬亭宋轶对视没有技巧全是感情,651843
11,王阳用口红在秦岚脸上留号码,605074
12,女子房子两年没住被邻居用衣柜封死,584105
13,女儿考满分农民工父亲买了只烧鸡庆祝,516518
14,化学老师跳下10米高桥救起轻生女子,496621
15,柴犬看了都想回日本,479657
16,大四男生实习薪资1万4妈妈仰天大笑,453811
17,真的别再关灯玩手机了,443085
18,长风渡首播反馈,381228
19,香港的辣度细分有多严谨,378430
20,为什么阴干的衣服那么臭,361615
21,千万不要在教资体检时穿裙子,357733
22,Jennie在舞台上走神,352506
23,女孩撞上食客被烫伤食客有责任吗,312560
24,建议魏大勋别看,268593
25,你心中的年代剧TOP1,250934
26,孟子义回应王鹤棣太红了疏远他,245862
27,白敬亭跟剧方争取的愿如长风OST,235156
28,星宇,231104
29,迪丽热巴赵昕互关,226190
30,中餐厅路透,225578
31,迪丽热巴手滑进了梦海直播间,208171
32,989大学,203454
33,肖春生对贺红玲真的只是一种情绪,200218
34,小猫的床有点过于豪华了,198001
35,毕业后被好多同学删除了好友,192784
36,新闻学专业真的是天坑专业吗,191549
37,梦海能成为肖战的养老剧吗,171607
38,花580元买梅西比赛门票被称幸运儿,167097
39,一代目绿娃成功戴上了一顶帽子,157583
40,中美关系处在建交以来的最低谷,152470
41,做家政的妈妈经常捡东西回来,146171
42,没想到刚转正就被公司辞退了,145117
43,宋亚轩美式证件照,145088
44,包工头用伦敦腔飙英语惊艳众人,142926
45,上海中考,134797
46,高铁上情侣想换座我拒绝了,123737
47,中美外长会谈结束,122256
48,父亲远行前为不让母亲干活插了秧打了药,118491
49,王嘉尔巴黎出发照,115757
50,布林肯,114503
