排名,标题,热度
1,迪丽热巴手滑进了梦海直播间,1073239
2,真的别再关灯玩手机了,944392
3,三夏农忙正当时,888567
4,989大学,840211
5,厦大新闻学教授谈张雪峰言论,726988
6,建议魏大勋别看,510188
7,大四男生实习薪资1万4妈妈仰天大笑,500180
8,女儿考满分农民工父亲买了只烧鸡庆祝,488723
9,女子房子两年没住被邻居用衣柜封死,470874
10,肖战 人生可不止这一片什刹海,433848
11,为什么阴干的衣服那么臭,383836
12,东航客服回应胡兵50万积分被清零,366283
13,女朋友说她拍到我出轨了,324084
14,白敬亭宋轶对视没有技巧全是感情,323033
15,高铁上情侣想换座我拒绝了,312600
16,Jennie在舞台上走神,278039
17,内蒙古城管执法中队负责人出轨女下属,263361
18,胡可三演白敬亭丈母娘,254280
19,长风渡首播反馈,232462
20,鞠婧祎29岁身材管理,222950
21,千万不要在这里装洞洞鞋鞋花,214152
22,王阳好会亲,168028
23,中美外长会谈结束,167547
24,这背影居然是蔡少芬,165087
25,想提离职结果被公司辞退了,154203
26,朴彩英四年前的发量vs现在的,146425
27,你会请三休八拼长假吗,143300
28,这个国家的纸币上印着袁老的杂交水稻,128253
29,18岁出考场vs23岁出考场,126626
30,相亲中的聊天记录,126573
31,如何婉转的告诉他已经上课了,126294
32,化学老师跳下10米高桥救起轻生女子,125930
33,西班牙夺得欧国联冠军,123274
34,布林肯,117095
35,鬼灭之刃,110345
36,清华大学vs广东工大,105647
37,五月天告五人,104612
38,ITZY回归预告,103646
39,Dream一个肖战李沁六搭,103567
40,有点担心与凤行剧情了,103208
41,梦中的那片海央视剧照,98323
42,等会这是猫最后一条命了,96721
43,白轶补贴情头,91142
44,一个人爱你的最高形式,88055
45,游客称玛雅海滩水公园泳池现卫生巾,87136
46,歌手演唱会价格一览,83679
47,白桃星座,83622
48,长风渡,82791
49,李现松弛感,81171
50,CCTV8剧说很好看,78086
