排名,标题,热度
1,你现在网购还常用淘宝吗,169701
2,庆余年2官宣阵容,122667
3,杭州亚运奖牌上的湖山长什么样,106340
4,蔡徐坤评论区回复粉丝,103606
5,Jennie新剧预告又跳舞了,97101
6,陶晶莹称希望黄子佼好好度过,96855
7,马云指出淘宝天猫未来三个方向,88326
8,朱一龙爸爸,83656
9,杭州一企业月薪1万2半年只招到两人,81357
10,网友拍到的龙吸水,66922
11,小S和舞蹈老师视频,64950
12,女子称母亲到派出所接受询问后死亡,58923
13,经常锻炼与不锻炼的人大腿肌肉的对比,58719
14,大S工作室回应吸毒指控,58652
15,厦门体育中心回应演唱会场地脏,57843
16,唐梓结婚,56968
17,黄子佼信息炸裂,56596
18,胡锡进 川大那名女生的事该有结果了,55458
19,五星红旗被捆绑酒店连说10句对不起,47465
20,唐老师,47159
21,黄子佼拿刀割自己,47070
22,澳大利亚一男子持刀入室抢劫被奸杀,46769
23,长风渡,46255
24,每个月工资8000但闲的发慌,45955
25,结婚五年面相都变了,45635
26,余景天新男团OneNEleven,45444
27,林志颖,45208
28,黑莲花攻略手册,45019
29,上帝要开空调了,41950
30,布林肯结束访华,41532
31,庆余年2官宣毛晓彤,41250
32,赵敏周芷若同框了,40899
33,庆余年叶灵儿,39612
34,范晓萱,35922
35,你太用力了所以走不远,34641
36,周俊伟,34297
37,调查称53.7%年轻人存款不足10万,33202
38,你是一具受潮的木乃伊,33096
39,在一起很久后必须分开的情况,32906
40,一听啤酒惹怒半个美国,32610
41,倪妮的珍珠首饰,32288
42,伊能静陪儿子逛街,32282
43,蔡徐坤香港演唱会hugme舞台,29489
44,王源回应妈妈进不去自己的演唱会,29360
45,朱一龙说曾掉到陈思诚家水池,29031
46,张踩铃 父与子完全不在一个世界,29008
47,石矶娘娘来了也穿不了,28817
48,小学班主任课间1分钟能处理多少事,28546
49,公司发了400端午过节费,28516
50,感觉自己花钱买了个工作,28290
