排名,标题,热度
1,你现在网购还常用淘宝吗,704301
2,朱一龙爸爸,649299
3,杭州亚运奖牌上的湖山长什么样,589091
4,蔡徐坤评论区回复粉丝,589023
5,庆余年2官宣阵容,588925
6,黄子佼信息炸裂,549187
7,杭州一企业月薪1万2半年只招到两人,447679
8,马云指出淘宝天猫未来三个方向,390617
9,林志颖,358919
10,经常锻炼与不锻炼的人大腿肌肉的对比,302760
11,小S和舞蹈老师视频,302126
12,胡锡进 川大那名女生的事该有结果了,298843
13,女子称母亲到派出所接受询问后死亡,295949
14,唐老师,293642
15,网友拍到的龙吸水,290807
16,唐梓结婚,289038
17,陶晶莹称希望黄子佼好好度过,286607
18,你是一具受潮的木乃伊,282194
19,布林肯结束访华,280191
20,大S工作室回应吸毒指控,277825
21,黄子佼拿刀割自己,276833
22,Jennie新剧预告又跳舞了,269089
23,结婚五年面相都变了,240093
24,每个月工资8000但闲的发慌,234098
25,澳大利亚一男子持刀入室抢劫被奸杀,231730
26,庆余年2官宣毛晓彤,231648
27,倪妮的珍珠首饰,230703
28,黑莲花攻略手册,226416
29,一听啤酒惹怒半个美国,218393
30,国足,214163
31,长风渡,213789
32,朱一龙说曾掉到陈思诚家水池,204443
33,伊能静陪儿子逛街,196780
34,上帝要开空调了,196544
35,五星红旗被捆绑酒店连说10句对不起,196539
36,庆余年叶灵儿,196536
37,赵敏周芷若同框了,179245
38,公司发了400端午过节费,173996
39,在一起很久后必须分开的情况,173658
40,调查称53.7%年轻人存款不足10万,173649
41,顾九思给柳玉茹下跪,173640
42,范晓萱,162580
43,周俊伟,150808
44,张晚意今天官宣了三部剧,150805
45,王源回应妈妈进不去自己的演唱会,150794
46,霍建华复出后首部作品,150774
47,感觉自己花钱买了个工作,150755
48,石矶娘娘来了也穿不了,150755
49,张踩铃 父与子完全不在一个世界,150729
50,你太用力了所以走不远,150725
