排名,标题,热度
1,你现在网购还常用淘宝吗,637685
2,庆余年2官宣阵容,465859
3,杭州亚运奖牌上的湖山长什么样,383819
4,蔡徐坤评论区回复粉丝,383798
5,朱一龙爸爸,383776
6,陶晶莹称希望黄子佼好好度过,379362
7,Jennie新剧预告又跳舞了,296501
8,杭州一企业月薪1万2半年只招到两人,285281
9,马云指出淘宝天猫未来三个方向,270027
10,经常锻炼与不锻炼的人大腿肌肉的对比,209765
11,小S和舞蹈老师视频,208675
12,胡锡进 川大那名女生的事该有结果了,203486
13,女子称母亲到派出所接受询问后死亡,165385
14,唐老师,161085
15,网友拍到的龙吸水,149600
16,唐梓结婚,149280
17,大S工作室回应吸毒指控,148909
18,你是一具受潮的木乃伊,147818
19,五星红旗被捆绑酒店连说10句对不起,147584
20,黄子佼信息炸裂,147134
21,黄子佼拿刀割自己,146440
22,庆余年2官宣毛晓彤,145430
23,布林肯结束访华,144862
24,澳大利亚一男子持刀入室抢劫被奸杀,144213
25,上帝要开空调了,144048
26,倪妮的珍珠首饰,143260
27,结婚五年面相都变了,142754
28,长风渡,141823
29,每个月工资8000但闲的发慌,141781
30,林志颖,136229
31,黑莲花攻略手册,130662
32,周俊伟,123095
33,伊能静陪儿子逛街,117307
34,赵敏周芷若同框了,114279
35,一听啤酒惹怒半个美国,113575
36,庆余年叶灵儿,113512
37,你太用力了所以走不远,113250
38,在一起很久后必须分开的情况,111544
39,公司发了400端午过节费,110848
40,调查称53.7%年轻人存款不足10万,109897
41,朱一龙说曾掉到陈思诚家水池,109106
42,顾九思给柳玉茹下跪,105942
43,范晓萱,101471
44,张晚意今天官宣了三部剧,95334
45,邓科被吐槽偏心,81464
46,王源回应妈妈进不去自己的演唱会,80316
47,石矶娘娘来了也穿不了,80310
48,国足,79524
49,感觉自己花钱买了个工作,78870
50,小学班主任课间1分钟能处理多少事,78178
